Unnamed: 0,titulo,link,data,site,descricao
0,Justiça inglesa rejeita recurso da BHP e mantém condenação pelo desastre de Mariana,https://jovempan.com.br/noticias/brasil/justica-inglesa-rejeita-recurso-da-bhp-e-mantem-condenacao-pelo-desastre-de-mariana.html,2026-05-06 09:03:00,Jovem Pan,Tribunal de Apelação encerra última via recursal comum no Reino Unido; processo agora avança para a fase de cálculo das indenizações às vítimas da tragédia
1,Inmet emite alerta de perigo para chuvas intensas em áreas da Região Norte,https://jovempan.com.br/noticias/brasil/inmet-emite-alerta-de-perigo-para-chuvas-intensas-em-areas-da-regiao-norte.html,2026-05-03 16:35:00,Jovem Pan,A previsão do Inmet é de chuva entre 30 e 60 milímetros (mm) e ventos que podem chegar a 100 quilômetros por hora (km/h)
2,Governo da Paraíba decreta estado de calamidade pública após fortes chuvas,https://jovempan.com.br/noticias/brasil/governo-da-paraiba-decreta-estado-de-calamidade-publica-apos-fortes-chuvas.html,2026-05-03 14:50:00,Jovem Pan,"De acordo com o Ministério da Integração e do Desenvolvimento Regional, o estado tem mais de 16 mil afetados pelas chuvas; duas pessoas morreram"
3,Chuvas no Nordeste causam 8 mortes e afetam mais de 10 mil pessoas,https://jovempan.com.br/noticias/brasil/chuvas-no-nordeste-causam-8-mortes-e-afetam-mais-de-10-mil-pessoas.html,2026-05-03 11:40:00,Jovem Pan,"Entre as vítimas estão um bebê de seis meses, outro de um ano e uma criança de 7 anos; tempestades provocaram danos em pelo menos 27 municípios do Pernambuco"
4,SP deve registrar queda de temperatura com chuva forte neste domingo,https://jovempan.com.br/noticias/brasil/sao-paulo-deve-registrar-queda-de-temperatura-com-chuva-forte-neste-domingo.html,2026-05-03 08:30:00,Jovem Pan,"A mudança do tempo é causada pelo avanço de uma frente fria mais ativa pelo oceano, o que provoca aumento significativo de instabilidade"
5,Inmet emite alerta após chuvas no Nordeste deixarem pelo menos 6 mortos,https://jovempan.com.br/noticias/brasil/inmet-emite-alerta-apos-chuvas-no-nordeste-deixarem-pelo-menos-6-mortos.html,2026-05-02 12:12:00,Jovem Pan,"De acordo com o órgão, a previsão é de temporais entre 50 e 100mm no dia e ventos intensos entre 60 e 100 km/h, com risco de corte de energia elétrica e alagamentos"
6,Chuvas fortes deixam ao menos 4 mortos e mais de 1 mil desalojados em Pernambuco,https://jovempan.com.br/noticias/brasil/chuvas-fortes-deixam-mortos-em-pernambuco.html,2026-05-01 19:56:00,Jovem Pan,A Defesa Civil estadual também registra cinco feridos
7,Chuvas: Governo envia Defesa Civil para Pernambuco e Paraíba,https://jovempan.com.br/noticias/brasil/chuvas-governo-envia-defesa-civil-para-pernambuco-e-paraiba.html,2026-05-01 19:07:00,Jovem Pan,Fortes chuvas atingem hoje as regiões
8,"SP e RJ terão sol e calor, mas frente fria traz chuva no domingo",https://jovempan.com.br/noticias/brasil/sp-e-rj-terao-sol-e-calor-mas-frente-fria-traz-chuva-no-domingo.html,2026-04-30 09:41:00,Jovem Pan,"Feriado prolongado de 1º de maio terá tempo firme em grande parte do Brasil, mas a passagem de uma massa fria atinge o sul e o sudeste"
9,Inmet emite diversos alertas para chuvas no país; veja estados afetados,https://jovempan.com.br/noticias/brasil/inmet-emite-diversos-alertas-para-chuvas-no-pais-veja-estados-afetados.html,2026-04-28 15:13:00,Jovem Pan,"Para São Paulo, há possibilidade de chuva de até 50 mm/dia, ventos intensos (40-60 km/h) e queda de granizo"
10,Frente fria provoca chuvas e derruba temperaturas no centro-sul,https://jovempan.com.br/noticias/brasil/frente-fria-provoca-chuvas-e-derruba-temperaturas-no-centro-sul.html,2026-04-28 06:52:00,Jovem Pan,"Alerta inclui ventos fortes, ressaca e risco de geada"
11,Seguro auto cobre enchente? O que a sua apólice realmente diz,https://jovempan.com.br/noticias/seguro-auto-cobre-enchente-o-que-a-sua-apolice-realmente-diz.html,2026-04-28 05:39:00,Jovem Pan,"Análise detalhada das coberturas, exclusões e procedimentos para acionar o seguro em caso de danos por água"
12,"El Niño deve entrar em ação em maio e afetar chuvas no Brasil, diz entidade internacional",https://jovempan.com.br/noticias/brasil/el-nino-deve-entrar-em-acao-em-maio-e-afetar-chuvas-no-brasil-diz-entidade-internacional.html,2026-04-27 14:19:00,Jovem Pan,"Segundo a Organização Meteorológica Mundial, as temperaturas da superfície do mar no Pacífico Equatorial estão subindo rapidamente após um período de neutralidade no início do ano"
13,Brasil tem alertas de tempestade e baixa umidade nesta quarta-feira,https://jovempan.com.br/noticias/brasil/brasil-tem-alertas-de-tempestade-e-baixa-umidade-nesta-quarta-feira.html,2026-04-22 12:00:00,Jovem Pan,"Norte e Nordeste estão sob alerta para chuvas intensas até quinta (23), com avisos laranja e amarelo do Inmet"
14,Pane elétrica na chuva: entenda as causas e como evitar o problema,https://jovempan.com.br/noticias/brasil/pane-eletrica-na-chuva-entenda-as-causas-e-como-evitar-o-problema.html,2026-04-19 03:50:00,Jovem Pan,Análise técnica dos componentes vulneráveis à água e guia de manutenção preventiva para dirigir com segurança em alagamento
15,Guia para dirigir à noite com chuva: visibilidade e segurança,https://jovempan.com.br/noticias/brasil/guia-para-dirigir-a-noite-com-chuva-visibilidade-e-seguranca.html,2026-04-19 02:01:00,Jovem Pan,"Técnicas de condução, manutenção preventiva e tecnologias para máxima segurança sob baixa visibilidade"
16,Ciclone extratropical atinge o Brasil nesta semana,https://jovempan.com.br/noticias/brasil/ciclone-extratropical-atinge-o-brasil-nesta-semana.html,2026-04-06 19:49:00,Jovem Pan,"Formação de uma área de baixa pressão entre a Argentina e o Uruguai deve dar origem a um ciclone extratropical entre esta segunda e terça-feira (07), impactando diretamente o Sul do país"
17,Chegada de frente fria no litoral deve causar chuva e queda de temperatura em SP,https://jovempan.com.br/noticias/brasil/chegada-de-frente-fria-no-litoral-deve-causar-chuva-e-queda-de-temperatura-em-sp.html,2026-04-06 13:18:00,Jovem Pan,"O Centro de Gerenciamento de Emergências (CGE) alerta que, ao longo da semana, o tempo deve mudar a partir da tarde, com previsão de pancadas de chuva generalizadas"
18,Inmet emite alerta de tempestades para maior parte do Brasil até terça,https://jovempan.com.br/noticias/brasil/inmet-emite-alerta-de-tempestades-para-maior-parte-do-brasil-ate-terca.html,2026-04-05 17:09:00,Jovem Pan,"Apesar dos avisos, por ora, o instituto avalia haver baixo risco de alagamentos, queda de galhos, corte de energia e estragos em plantações"
19,Domingo de Páscoa terá calor e pancadas de chuva,https://jovempan.com.br/noticias/brasil/domingo-de-pascoa-tera-calor-e-pancadas-de-chuva.html,2026-04-04 17:41:00,Jovem Pan,"Neste sábado, os termômetros na capital paulista chegaram a registrar 32°C na região da Avenida Paulista"
20,Chegada de ciclone e frente fria aumenta a chance de chuvas no país,https://jovempan.com.br/noticias/brasil/chegada-de-ciclone-e-frente-fria-aumenta-a-chance-de-chuvas-no-pais.html,2026-03-24 11:54:00,Jovem Pan,Primeira semana do outono começa com mudanças no tempo em diferentes regiões
21,"Chuva dá trégua em SP nesta sexta, mas Sudeste segue em alerta",https://jovempan.com.br/programas/jornal-da-manha/chuva-da-tregua-em-sp-nesta-sexta-mas-sudeste-segue-em-alerta.html,2026-03-13 08:14:00,Jovem Pan,"Temperatura em São Paulo sobe, com máxima prevista de 26ºC; instabilidades são esperadas no Norte e Centro-Oeste"
22,Cidade de SP entra em alerta vermelho para fortes chuvas e alagamentos,https://jovempan.com.br/noticias/brasil/cidade-de-sp-entra-em-alerta-vermelho-para-fortes-chuvas-e-alagamentos.html,2026-03-12 10:16:00,Jovem Pan,Inmet informou que há risco de precipitação superior a 60 milímetros por hora ou acima de 100 milímetros por dia
23,São Paulo pode receber mais da metade da chuva prevista para março nos próximos quatro dias,https://jovempan.com.br/noticias/brasil/sao-paulo-pode-receber-mais-da-metade-da-chuva-prevista-para-marco-nos-proximos-dias.html,2026-03-09 21:56:00,Jovem Pan,Gabinete de Crise da Defesa Civil segue monitorando; cenário é de atenção para o estado paulista
24,Defesa Civil emite alerta para chuvas intensas em São Paulo até quarta-feira,https://jovempan.com.br/noticias/brasil/defesa-civil-emite-alerta-para-chuvas-intensas-em-sao-paulo-para-ate-quarta-feira.html,2026-03-09 12:32:00,Jovem Pan,"Órgão informou que a previsão para os próximos dias é de tempestades, rajadas de vento e raios em diferentes regiões do estado"
25,Fortes chuvas destroem academia de crossfit na Zona Sul de SP,https://jovempan.com.br/programas/jornal-da-manha/fortes-chuvas-destroem-academia-de-crossfit-na-zona-sul-de-sp.html,2026-03-09 11:12:00,Jovem Pan,"Em entrevista à Jovem Pan, o responsável pelo local, Ricardo Tost, afirmou que prejuízo estimado ultrapassa a marca dos R$ 100 mil"
26,Chuvas provocam duas mortes em SP neste sábado,https://jovempan.com.br/noticias/brasil/chuvas-provocam-morte-de-duas-pessoas-em-sp.html,2026-03-08 11:19:00,Jovem Pan,Previsão para o domingo é de mais chuvas com rajadas de ventos
27,Inmet emite alerta laranja para ventos e tempestades no Sul e Sudeste,https://jovempan.com.br/noticias/brasil/inmet-emite-alerta-laranja-para-ventos-e-tempestades-no-sul-e-sudeste.html,2026-03-07 11:39:00,Jovem Pan,"No Rio Grande do Sul a chuva deve alcançar entre 50 e 10 milímetros por dia, com ventos que podem chegar a 100 quilômetros por hora"
28,Forte chuva coloca regiões de São Paulo em estado de atenção para alagamentos,https://jovempan.com.br/noticias/brasil/forte-chuva-coloca-regioes-de-sao-paulo-em-estado-de-atencao-para-alagamentos.html,2026-03-07 09:28:00,Jovem Pan,"Temporal na manhã deste sábado (7) atinge zonas norte, oeste e centro da capital, além da Marginal Tietê, menos de 24 horas após outra chuva causar estragos na cidade"
29,Cidade de SP entra em estado de atenção para alagamentos; Defesa Civil emite alerta,https://jovempan.com.br/noticias/brasil/cidade-de-sp-entra-em-estado-de-atencao-para-alagamentos-defesa-civil-emite-alerta.html,2026-03-06 13:45:00,Jovem Pan,"Imagens do radar meteorológico do CGE da Prefeitura de São Paulo mostram chuva nas zonas Norte, Oeste e Leste"
30,Inmet emite alertas laranja e amarelo para chuvas em SP e outros estados,https://jovempan.com.br/noticias/brasil/inmet-emite-alertas-laranja-e-amarelo-para-chuvas-em-sp-e-outros-estados.html,2026-03-06 13:21:00,Jovem Pan,"No domingo (8), a aproximação de uma frente fria muda o tempo na cidade de São Paulo"
31,Sobe para 72 o número de mortos nas chuvas em Minas Gerais,https://jovempan.com.br/noticias/brasil/sobe-para-72-o-numero-de-mortos-nas-chuvas-em-minas-gerais.html,2026-03-01 10:38:00,Jovem Pan,"Uma pessoa continua desaparecida em Ubá, segundo Polícia Civil"
32,"Minas Gerais, Rio de Janeiro e outros estados seguem com alerta vermelho para chuvas",https://jovempan.com.br/noticias/brasil/minas-gerais-rio-de-janeiro-e-outros-estados-seguem-com-alerta-vermelho-para-chuvas.html,2026-02-27 12:21:00,Jovem Pan,O alerta vermelho para acúmulo de chuva indica precipitação superior a 60 mm/h ou acima de 100 mm/dia
33,Chuvas em Minas Gerais: Sobe para 64 número de mortos,https://jovempan.com.br/noticias/brasil/chuvas-minas-gerais-numero-de-mortos.html,2026-02-26 09:40:00,Jovem Pan,"Temporais que atingiram Juiz de Fora, Ubá e outros municípios da Zona da Mata também deixaram desaparecidos e centenas de pessoas foram resgatadas na região"
34,Chuvas deixam desabrigados e cenário de incerteza em Juiz de Fora,https://jovempan.com.br/noticias/brasil/chuvas-deixam-desabrigados-e-cenario-de-incerteza-em-juiz-de-fora.html,2026-02-26 06:33:00,Jovem Pan,Mais de 3 mil pessoas estão sem moradia fixa desde segunda-feira (23)
35,Juiz de Fora volta a registrar chuvas fortes; veja vídeos,https://jovempan.com.br/noticias/brasil/juiz-de-fora-volta-a-registrar-chuvas-fortes-veja-videos.html,2026-02-25 23:32:00,Jovem Pan,"Município está em estado de calamidade desde a passagem de um temporal na Zona da Mata mineira, na segunda-feira (23)"
36,"Minas tem risco de novas chuvas nesta semana, diz Inmet",https://jovempan.com.br/noticias/brasil/minas-tem-risco-de-novas-chuvas-nesta-semana-diz-inmet.html,2026-02-25 11:26:00,Jovem Pan,"Segundo instituto, a precipitação será superior a 60 milímetros por hora ou acima de 100 mm/dia; fevereiro é um dos meses mais chuvosos dos últimos anos no estado"
37,Zema diz que o governo faz ‘todo o esforço possível’ para auxiliar vítimas das chuvas,https://jovempan.com.br/noticias/brasil/zema-diz-que-o-governo-faz-todo-o-esforco-possivel-para-auxiliar-vitimas-das-chuvas.html,2026-02-24 22:05:00,Jovem Pan,O gestor lamentou o ocorrido e disse que a ajuda humanitária de Belo Horizonte já está a caminho das cidades afetadas
38,Prefeita de Juiz de Fora faz alerta para ‘novos eventos críticos’ em relação às chuvas,https://jovempan.com.br/noticias/brasil/prefeita-de-juiz-de-fora-faz-alerta-para-novos-eventos-criticos-em-relacao-as-chuvas.html,2026-02-24 17:56:00,Jovem Pan,Margarida Salomão fez questão de recomendar que qualquer um que esteja em lugar de risco saia imediatamente
39,"Entenda o que é ‘supercélula’, fenômeno que causou chuva extrema em MG",https://jovempan.com.br/noticias/brasil/entenda-o-que-e-supercelula-fenomeno-que-causou-chuva-extrema-em-mg.html,2026-02-24 14:48:00,Jovem Pan,"O evento climático pode gerar ventos fortes, granizo, chuvas intensas e tornados"
40,Tempestade deixa mais de 300 pessoas desabrigadas no litoral de São Paulo,https://jovempan.com.br/noticias/brasil/chuvas-litoral-sao-paulo.html,2026-02-24 11:22:00,Jovem Pan,"Peruíbe é o município mais atingido, com 56 milímetros de água acumulados em um dia; não foram registradas vítimas"
41,Chuvas deixam ao menos 30 mortos em Minas Gerais; Juiz de Fora decreta calamidade,https://jovempan.com.br/noticias/brasil/chuvas-deixam-mortes-na-zona-da-mata-juiz-de-fora-decreta-estado-de-calamidade.html,2026-02-24 08:12:00,Jovem Pan,"Vinte e quatro mortes aconteceram em Juiz de Fora, e seis no município de Ubá"
42,Ubatuba decreta situação de emergência após chuvas no fim de semana,https://jovempan.com.br/noticias/brasil/ubatuba-decreta-situacao-de-emergencia-apos-chuvas-no-fim-de-semana.html,2026-02-23 14:06:00,Jovem Pan,"Neste domingo, 15 famílias ficaram desabrigadas e outras 15 foram desalojadas"
43,Naufrágio provocado por chuva forte deixa dois mortos em Ubatuba,https://jovempan.com.br/noticias/brasil/naufragio-provocado-por-chuva-forte-deixa-dois-mortos-em-ubatuba.html,2026-02-22 14:00:00,Jovem Pan,"Outras três pessoas foram resgatadas com vida próximo ao bairro de Ponta Grossa, segundo o Grupamento de Bombeiros Marítimo"
44,Frente fria coloca estado de SP em alerta para chuvas fortes e risco de alagamentos,https://jovempan.com.br/noticias/brasil/frente-fria-coloca-estado-de-sp-em-alerta-para-chuvas-fortes-e-risco-de-alagamentos.html,2026-02-18 08:36:00,Jovem Pan,"De acordo com a Defesa Civil, previsão é de risco de granizo, alagamentos e deslizamentos entre essa quarta (18) e quinta-feira (19)"
45,Enchente em Guarulhos arrasta mulher e deixa pessoas ilhadas,https://jovempan.com.br/noticias/brasil/enchente-em-guarulhos-arrasta-mulher-e-deixa-pessoas-ilhadas.html,2026-02-17 08:19:00,Jovem Pan,Não há registro de mortos ou feridos em Guarulhos.
46,Carnaval deve ter chuva e calor em grande parte do país,https://jovempan.com.br/noticias/brasil/carnaval-deve-ter-chuva-e-calor-em-grande-parte-do-pais.html,2026-02-13 13:39:00,Jovem Pan,"Previsão indica chuva localizada principalmente à tarde, com temperaturas em elevação ao longo do dia"
47,Defesa Civil coloca 45 cidades de SP em atenção para deslizamentos,https://jovempan.com.br/noticias/brasil/defesa-civil-coloca-45-cidades-de-sp-em-atencao-para-deslizamentos.html,2026-02-10 12:48:00,Jovem Pan,Chuvas intensas nas últimas 72 horas saturaram o solo e elevaram o risco em áreas de encosta no estado
48,Inmet emite alerta de chuvas intensas para todas as regiões do Brasil,https://jovempan.com.br/noticias/brasil/inmet-emite-alerta-de-chuvas-intensas-para-todas-as-regioes-do-brasil.html,2026-02-09 08:18:00,Jovem Pan,"De acordo com o instituto, em algumas áreas, o volume de precipitação pode chegar a 100 milímetros em 24 horas nesta segunda-feira (9)"
49,Defesa Civil de SP mobiliza gabinete de crise após tempestades no estado,https://jovempan.com.br/noticias/brasil/defesa-civil-de-sp-mobiliza-gabinete-de-crise-tempestades-no-estado.html,2026-02-08 13:38:00,Jovem Pan,"Em São Carlos, em 24 horas, choveu o volume esperado para 24 dias; previsão indica manutenção do risco de alagamentos e deslizamentos entre este domingo (8) e segunda-feira (9)"
50,Defesa Civil de SP alerta para risco de chuvas ‘fortes e persistentes’,https://jovempan.com.br/noticias/brasil/defesa-civil-de-sp-alerta-para-risco-de-chuvas-fortes-e-persistentes.html,2026-02-07 11:00:00,Jovem Pan,"Alerta indica que, entre sábado (7) e segunda-feira (9), a previsão é de chuva persistente em todo o Estado e Gabinete de Crise será instalado em formato remoto."
51,Inmet divulga alerta de perigo sobre chuvas intensas na Paraíba,https://jovempan.com.br/noticias/brasil/inmet-divulga-alerta-de-perigo-sobre-chuvas-intensas-na-paraiba.html,2026-02-06 21:36:00,Jovem Pan,"Em João Pessoa, na capital do estado, o registro foi de chuva acima da média histórica para todo o mês de fevereiro"
52,Frente fria provoca chuva e queda de temperaturas em SP e em outros Estados,https://jovempan.com.br/noticias/brasil/frente-fria-provoca-chuva-e-queda-de-temperaturas-em-sp-e-em-outros-estados.html,2026-02-05 10:40:00,Jovem Pan,"De acordo com informações da Climatempo, a combinação entre calor, umidade elevada e a aproximação da frente fria irão favorecer a ocorrência de pancadas de chuva moderadas a fortes, principalmente no período da tarde e da noite"
53,Onda de calor atinge o Sul enquanto SP entra em alerta para tempestades,https://jovempan.com.br/noticias/brasil/onda-de-calor-atinge-o-sul-enquanto-sp-entra-em-alerta-para-tempestades.html,2026-02-04 11:10:00,Jovem Pan,Inmet prevê temperaturas elevadas por mais de cinco dias no Sul e risco de alagamentos e granizo em outras regiões do país
54,Defesa Civil de SP alerta para risco de tempestades nesta segunda-feira,https://jovempan.com.br/noticias/brasil/defesa-civil-de-sp-alerta-para-risco-de-tempestades-nesta-segunda-feira.html,2026-02-02 06:35:00,Jovem Pan,"Alerta indica que a previsão é de pancadas de chuva persistentes, acompanhadas por raios, ventos e possibilidade de granizo até terça-feira (3)"
55,Ciclone extratropical intensifica chuvas em São Paulo nesta sexta-feira,https://jovempan.com.br/noticias/brasil/ciclone-extratropical-intensifica-chuvas-em-sao-paulo-nesta-sexta-feira.html,2026-01-30 10:14:00,Jovem Pan,Defesa Civil coloca em prática um plano de contingência e alerta para o risco de alagamentos e deslizamentos de terra
56,SP entra em alerta para tempestades e risco de alagamentos nesta quinta-feira,https://jovempan.com.br/noticias/brasil/sp-entra-em-alerta-para-tempestades-e-risco-de-alagamentos-nesta-quinta-feira.html,2026-01-29 13:01:00,Jovem Pan,"Previsão aponta chuva forte, granizo e rajadas de vento a partir da tarde; temperatura máxima deve cair para 25ºC na sexta-feira (30)"
57,"Chuva em SP gera alagamento, deixa pessoas ilhadas e interrompe circulação de trens",https://jovempan.com.br/noticias/brasil/chuva-em-sp-gera-alagamento-deixa-pessoas-ilhadas-e-interrompe-circulacao-de-trens.html,2026-01-28 20:22:00,Jovem Pan,"De acordo com o Corpo de Bombeiros, a corporação registrou 54 chamados relacionados a enchentes nas cidades de Suzano, Mogi das Cruzes, Poá, Itaquaquecetuba e Guarulhos, além da zona leste da capital"
58,Como escolher o melhor app para monitorar raios e chuvas no verão,https://jovempan.com.br/noticias/brasil/como-escolher-o-melhor-app-para-monitorar-raios-e-chuvas-no-verao.html,2026-01-28 02:00:00,Jovem Pan,Ferramentas digitais baseadas em dados de radar e satélite para a segurança meteorológica em tempo real.
59,São Paulo entra em estado de atenção para chuva; 80 mil estão sem luz,https://jovempan.com.br/noticias/brasil/t-sao-paulo-entra-em-estado-de-atencao-para-chuva-80-mil-estao-sem-luz.html,2026-01-27 16:18:00,Jovem Pan,"Segundo o CGE, as marginais Pinheiros e Tietê estão em estado de atenção para alagamentos"
60,"Após morte e transtornos no fim de semana, SP tem previsão de mais chuva nos próximos dias",https://jovempan.com.br/noticias/brasil/apos-morte-e-transtornos-no-fim-de-semana-sp-tem-previsao-de-mais-chuva-nos-proximos-dias.html,2026-01-26 08:46:00,Jovem Pan,Mesmo com temperaturas em elevação a semana também será marcada por volumes de chuva
61,"Sete anos após tragédia de Brumadinho, Justiça prepara início das audiências para fevereiro",https://jovempan.com.br/noticias/brasil/sete-anos-apos-tragedia-de-brumadinho-justica-prepara-inicio-das-audiencias-para-fevereiro.html,2026-01-25 08:01:00,Jovem Pan,Juíza Federal define cronograma que começa dia 23 do próximo mês; sessões vão julgar crimes ambientais e as responsabilidades pelas 270 mortes
62,Inmet emite alertas para chuvas no Brasil; saiba estados afetados,https://jovempan.com.br/noticias/brasil/inmet-emite-alertas-para-chuvas-no-brasil-saiba-estados-afetatos.html,2026-01-22 13:02:00,Jovem Pan,"Das cinco regiões, apenas os Estados do Sul estão fora dos alertas, que valem até o próximo sábado"
63,Semana começa com risco de chuva extrema em várias partes do Brasil: ‘Grande perigo’,https://jovempan.com.br/noticias/brasil/semana-comeca-com-risco-de-chuva-extrema-em-varias-partes-do-brasil-grande-perigo.html,2026-01-18 19:06:00,Jovem Pan,
64,Chuvas fortes devem atingir SP novamente neste domingo,https://jovempan.com.br/noticias/brasil/chuvas-fortes-devem-atingir-sp-novamente-neste-domingo.html,2026-01-18 10:57:00,Jovem Pan,Frente fria deve derrubar as temperaturas a partir de segunda-feira (19)
65,Chuvas abaixo da média tendem a persistir e agravar seca em São Paulo,https://jovempan.com.br/noticias/brasil/chuvas-abaixo-da-media-tendem-a-persistir-e-agravar-seca-em-sao-paulo.html,2026-01-17 10:21:00,Jovem Pan,"Situação se deve à dificuldade de avanço de frentes frias e da umidade, condições que têm relação com a alta anômala causada pela persistência do fenômeno La Niña no Oceano Pacífico"
66,Chuva deixa cidade de SP em estado de atenção para alagamentos,https://jovempan.com.br/noticias/brasil/chuva-deixa-cidade-de-sp-em-estado-de-atencao-para-alagamentos.html,2026-01-15 17:36:00,Jovem Pan,"Há potencial para rajadas de vento, descargas elétricas (raios) e eventuais quedas de granizo, bem comum nesta época do ano, em função dos fortes temporais nos fins de tarde"
67,Queda de árvore mata mulher e SP chega a dez mortes por causa das chuvas,https://jovempan.com.br/noticias/brasil/queda-de-arvore-mata-mulher-e-sp-chega-a-dez-mortes-por-causa-das-chuvas.html,2026-01-15 11:14:00,Jovem Pan,"Vítima de 35 anos estava na Rodovia Oswaldo Cruz, em Taubaté, nesta quarta (14); segundo ocupante do veículo ficou preso às ferragens e foi socorrido consciente"
68,São Paulo entra em estado de atenção após chuva intensa,https://jovempan.com.br/noticias/brasil/sao-paulo-entra-em-estado-de-atencao-apos-chuva-intensa.html,2026-01-14 16:09:00,Jovem Pan,"Previsão é que a cidade enfrente dias mais chuvosos nesta semana, em razão da propagação de áreas de instabilidade oriundas do interior paulista e associadas ao calor e umidade nos finais de tarde"
69,"São Paulo entra em estado de atenção após forte chuva, ventania e queda de granizo",https://jovempan.com.br/noticias/brasil/sao-paulo-entra-em-estado-de-atencao-apos-forte-chuva-ventania-e-queda-de-granizo.html,2026-01-13 20:55:00,Jovem Pan,Centro de Gerenciamento de Emergências Climáticas (CGE) informou que todas as regiões da capital entraram em estado de atenção para alagamentos
70,Calor e alta umidade favorecem pancadas de chuva isoladas em São Paulo nesta terça,https://jovempan.com.br/noticias/brasil/calor-e-alta-umidade-favorecem-pancadas-de-chuva-isoladas-em-sao-paulo-nesta-terca.html,2026-01-13 06:45:00,Jovem Pan,"Sol entre nuvens mantém sensação de abafamento, e instabilidades podem provocar chuva forte, raios e rajadas de vento em pontos do estado"
71,Inmet emite alerta amarelo para temporais e chuvas intensas em diversas regiões do país,https://jovempan.com.br/noticias/brasil/inmet-emite-alerta-amarelo-para-temporais-e-chuvas-intensas-em-diversas-regioes-do-pais.html,2026-01-12 09:56:00,Jovem Pan,Avisos desta segunda-feira (12) atingem do Sul ao Nordeste; ciclone que provocou estragos no fim de semana perde força e se afasta da costa
72,Primeiro ciclone de 2026 atinge centro-sul do país; leia estados afetados,https://jovempan.com.br/noticias/brasil/primeiro-ciclone-de-2026-atinge-centro-sul-do-pais-leia-estados-afetados.html,2026-01-09 19:37:00,Jovem Pan,"Rio Grande do Sul, Santa Catarina, Paraná, São Paulo e Mato Grosso do Sul vão sentir os efeitos do fenômeno"
73,Defesa Civil alerta para chegada de frente fria e chuva isolada em SP no fim de semana,https://jovempan.com.br/noticias/brasil/defesa-civil-alerta-para-chegada-de-frente-fria-e-chuva-isolada-em-sp-no-fim-de-semana.html,2026-01-09 09:33:00,Jovem Pan,"Efeitos associados a ciclone no Sul do Brasil serão sentidos no sábado (10) e domingo (11), sem impactos significativos nesta sexta-feira (9)"
