Unnamed: 0,titulo,link,data,site,descricao
469,Saque calamidade está disponível para trabalhadores atingidos pelas enchentes no RS,https://jovempan.com.br/noticias/brasil/saque-calamidade-esta-disponivel-para-trabalhadores-atingidos-pelas-enchentes-no-rs.html,2024-05-18 07:55:00,Jovem Pan,Reportagem da Jovem Pan News fala sobre medidas emergencias que os moradores do sul terão direito de acessar; é permitido que cada trabalhador afetado retire até R$ 6.220 de suas contas do FGTS
470,Enchentes no RS: casal de idosos é resgatado por voluntários,https://jovempan.com.br/programas/jornal-da-manha/enchentes-no-rs-casal-de-idosos-e-resgatado-por-voluntarios.html,2024-05-17 08:00:00,Jovem Pan,"Sem água e sem alimentação, eles aceitaram sair do imóvel; estado gaúcho registra mais de 150 vítimas e aproximadamente 538 mil pessoas desalojadas"
471,Quase 12 mil animais já foram resgatados das enchentes no RS,https://jovempan.com.br/noticias/brasil/quase-12-mil-animais-ja-foram-resgatados-das-enchentes-no-rs.html,2024-05-16 20:08:00,Jovem Pan,ONGs e voluntários estão na linha de frente desde o início das chuvas para salvar os bichos
472,"Gisele Bündchen arrecada R$ 4,5 milhões para vítimas de enchentes no RS",https://jovempan.com.br/entretenimento/famosos/gisele-bundchen-arrecada-r-45-milhoes-para-vitimas-de-enchentes-no-rs.html,2024-05-16 17:29:00,Jovem Pan,Gaúcha tem usado suas redes sociais para pedir ajuda ao Estado brasileiro e incentivado as doações para instituições do sul
473,Sobe para 151 o número de mortos em decorrência das chuvas e enchentes no Rio Grande do Sul,https://jovempan.com.br/noticias/brasil/sobe-para-151-o-numero-de-mortos-em-decorrencia-das-chuvas-e-enchentes-no-rio-grande-do-sul.html,2024-05-16 14:52:00,Jovem Pan,"Registro de desaparecidos recuou para 104; temporais já afetaram mais de 2,2 milhões de gaúchos em 458 municípios, o que equivale a 92% de todo o Estado"
474,Casal mineiro presta auxílio a moradores atingidos pelas enchentes no RS,https://jovempan.com.br/programas/jornal-da-manha/casal-mineiro-presta-auxilio-a-moradores-atingidos-pelas-enchentes-no-rs.html,2024-05-16 10:50:00,Jovem Pan,"Elaine e Danilo foram tocados pela situação durante uma visita prévia à região; além de um ambiente acolhedor, o motorhome oferece alimentação e roupas"
475,"Vítimas da tragédia em Brumadinho autorizam repasse de R$ 2,2 mi ao RS",https://jovempan.com.br/noticias/brasil/vitimas-da-tragedia-em-brumadinho-autorizam-repasse-de-r-22-mi-ao-rs.html,2024-05-14 12:14:00,Jovem Pan,Decisão foi informada por meio das redes sociais da Associação dos Familiares de Vítimas e Atingidos pelo Rompimento da Barragem da Mina Córrego do Feijão (Avabrum)
476,Jovem Pan inicia campanha de doação de rádios a pilha para vítimas das enchentes no RS,https://jovempan.com.br/noticias/brasil/jovem-pan-inicia-campanha-de-doacao-de-radios-a-pilha-para-vitimas-das-enchentes-no-rs.html,2024-05-14 11:48:00,Jovem Pan,"Iniciativa visa fornecer um meio de comunicação essencial para essas famílias, permitindo que elas recebam informações vitais sobre locais seguros e orientações importantes"
477,"Governo suspende prestações do ‘Minha Casa, Minha Vida’ para vítimas das chuvas no RS",https://jovempan.com.br/programas/jornal-da-manha/governo-suspende-prestacoes-do-minha-casa-minha-vida-para-vitimas-das-chuvas-no-rs.html,2024-05-14 09:13:00,Jovem Pan,Solicitações de suspensão de cobranças podem ser feitas à Caixa Econômica Federal por telefone
478,"Com retorno das chuvas, águas voltam a subir no RS; Estado tem 147 mortos pelas enchentes",https://jovempan.com.br/noticias/brasil/com-retorno-das-chuvas-aguas-voltam-a-subir-no-rs-estado-tem-147-mortos-pelas-enchentes.html,2024-05-13 10:27:00,Jovem Pan,"No município de Esteio, houve evacuação da população de alguns bairros, em Caxias do Sul a ponte do Rio Caí cedeu e na madrugada moradores sentiram tremores de terra, avaliados pela Defesa Civil como acomodação do solo"
479,"Chuvas persistem e afetam mais de 2,1 milhões de pessoas, em 446 cidades no RS; chega a 143 número de mortos",https://jovempan.com.br/noticias/brasil/chuvas-persistem-e-afetam-mais-de-21-milhoes-de-pessoas-em-446-cidades-no-rs-chega-a-143-numero-de-mortos.html,2024-05-12 09:56:00,Jovem Pan,"Bloqueio atmosférico causado por uma frente estacionária vai continuar provocando instabilidade no tempo, com volumes de 30 a 50 mm de chuva, ao menos até quarta (15); Cemaden considera muito alta a possibilidade de novos alagamentos em várias regiões"
480,Chuvas no Rio Grande do Sul vão parar? Meteorologista analisa,https://jovempan.com.br/noticias/brasil/chuvas-no-rio-grande-do-sul-vao-parar-meteorologista-analisa.html,2024-05-11 16:29:00,Jovem Pan,"Glauco Freitas explica que estado sofre com um bloqueio atmosférico, caracterizado por sistemas frontais estacionados que provocam chuvas contínuas, especialmente na faixa central"
481,Final de semana deve ser de chuvas fortes e frio no Rio Grande do Sul,https://jovempan.com.br/noticias/brasil/final-de-semana-deve-ser-de-chuvas-fortes-e-frio-no-rio-grande-do-sul.html,2024-05-10 16:12:00,Jovem Pan,"Hospitais da região estão em estado de alerta, com aumento no número de pacientes devido às vítimas das enchentes; Eduardo Leite fez apelo para que população não tente retornar às suas residências"
482,Sobe para 126 o número de mortos em decorrência das chuvas no Rio Grande do Sul,https://jovempan.com.br/noticias/brasil/com-queda-brusca-de-temperatura-e-mais-chuvas-rs-chega-a-113-mortos-e-mais-de-337-mil-desabrigados.html,2024-05-10 10:42:00,Jovem Pan,"Estado contabiliza quase 2 milhões de pessoas afetadas, 756 feridos e 441 municípios atingidos; previsão de chuva e queda de temperatura preocupam as autoridades"
483,Maranhão tem 31 cidades em situação de emergência após fortes chuvas,https://jovempan.com.br/noticias/brasil/maranhao-tem-1-031-familias-desabrigadas-devido-as-fortes-chuvas.html,2024-05-10 10:17:00,Jovem Pan,Município de Santa Inês é o único em estado de calamidade pública
484,Morador de São Leopoldo se emociona ao falar sobre desastre no RS: ‘Perdi tudo’,https://jovempan.com.br/programas/jornal-da-manha/morador-de-sao-leopoldo-se-emociona-ao-falar-sobre-desastre-no-rs-perdi-tudo.html,2024-05-09 12:32:00,Jovem Pan,Daniel Daut falou à reportagem da Jovem Pan News sobre luta para encontrar segurança para sua família nos andares superiores de edifícios próximos
485,"Sobe para 107 o número de mortos no RS, que tem cerca de 165 mil desalojados devido às chuvas",https://jovempan.com.br/noticias/brasil/sobe-para-107-o-numero-de-mortos-no-rs-que-tem-quase-165-mil-desalojados.html,2024-05-09 10:15:00,Jovem Pan,"Em todo o Estado já são 425 os municípios atingidos, afetando 1.476.170 pessoas. Os abrigos atendem 67.542 cidadãos"
486,"Chuvas no Rio Grande do Sul afetam quase 1,5 milhão de pessoas",https://jovempan.com.br/noticias/brasil/chuvas-no-rio-grande-do-sul-afetam-quase-15-milhao-de-pessoas.html,2024-05-08 22:10:00,Jovem Pan,"De acordo com o último boletim da Defesa Civil, cerca de 520,7 mil de indivíduos estão vivendo em áreas que precisaram ser evacuadas devido às enchentes que assolam o Estado e  163,8 mil estão desabrigadas"
487,Bebê desaparece em enchente durante resgate no RS e mãe usa redes sociais para pedir ajuda,https://jovempan.com.br/noticias/brasil/bebe-desaparece-em-enchente-durante-resgate-no-rs-e-mae-usa-redes-sociais-para-pedir-ajuda.html,2024-05-08 18:02:00,Jovem Pan,Família é composta pelo casal Gabrielli e Alisson e os quatro filhos; duas das crianças estão internadas
488,FAB resgata vítimas das enchentes no Rio Grande do Sul,https://jovempan.com.br/noticias/brasil/pessoa-em-estado-grave-e-mulher-em-trabalho-de-parto-sao-resgatados-pela-fab-no-rio-grande-do-sul.html,2024-05-08 15:24:00,Jovem Pan,Operação Taquari II tem ajudado as vítimas das enchentes e nas doações de suprimentos e produtos básicos
489,Empresas doam R$ 14 milhões para vítimas de tragédia no RS,https://jovempan.com.br/noticias/brasil/empresas-doam-r-14-milhoes-para-vitimas-de-tragedia-no-rs.html,2024-05-08 13:57:00,Jovem Pan,"Companhia e diversos setores se unem em apoio às vítimas da tragédia no RS, não só na arrecadação de dinheiro, mas na oferta de serviços, doação de cestas básicas e itens essenciais"
490,"Ex-BBBs Amanda, Thelminha e Marcela vão para RS ajudar a atender vítimas das enchentes",https://jovempan.com.br/entretenimento/famosos/ex-bbbs-amanda-thelminha-e-marcela-vao-para-rs-ajudar-a-atender-vitimas-das-enchentes.html,2024-05-08 11:47:00,Jovem Pan,"Em vídeo compartilhado nas redes sociais, as médicas pedem doações de medicamentos, roupas e suprimentos hospitalares"
491,Ciclone extratropical na Argentina pode levar ventos fortes e mais chuvas ao Rio Grande do Sul,https://jovempan.com.br/noticias/brasil/ciclone-extratropical-traz-ventos-fortes-e-mais-chuvas-ao-rio-grande-do-sul.html,2024-05-08 08:29:00,Jovem Pan,"Chegada do ciclone também deve causar queda acentuada nas temperaturas, o que pode dificultar as buscas por desaparecidos e as ações de resgate"
492,INSS anuncia antecipação de aposentadoria e outros benefícios para vítimas das enchentes no Rio Grande do Sul,https://jovempan.com.br/noticias/economia/inss-anuncia-antecipacao-de-aposentadoria-e-outros-beneficios-para-vitimas-das-enchentes-no-rio-grande-do-sul.html,2024-05-07 14:37:00,Jovem Pan,"Medida prevê a liberação conjunta dos pagamentos referentes aos meses de maio e junho, começando no próximo dia 24; serão contemplados os moradores de municípios declarados em estado de calamidade pública"
493,Mais de 6.000 animais são resgatados das enchentes do Rio Grande do Sul; saiba como ajudar,https://jovempan.com.br/noticias/brasil/mais-de-6-000-animais-sao-resgatados-das-enchentes-do-rio-grande-do-sul-saiba-como-ajudar.html,2024-05-07 13:55:00,Jovem Pan,"ONGs ainda pedem ajuda pelas redes sociais; cachorros, cavalos e gatos têm sido retirados diariamente dos escombros"
494,"Rio Grande do Sul chega a 95 mortos, 131 desaparecidos e 401 cidades afetadas pelas chuvas intensas",https://jovempan.com.br/noticias/brasil/rs-tem-90-mortos-e-132-desaparecidos-por-conta-dos-temporais-governo-emite-alerta-de-risco-para-municipios-ao-sul-do-estado.html,2024-05-07 10:55:00,Jovem Pan,"Estado projeta novas inundações com chegada de frente fria, sobretudo na Serra Gaúcha e no Vale do Taquari; além do caos provocado pelas enchentes, região metropolitana sofre com onda de roubos e saques"
495,CNA anuncia doação para vítimas das enchentes no Rio Grande do Sul,https://jovempan.com.br/noticias/brasil/cna-anuncia-doacao-para-vitimas-das-enchentes-no-rio-grande-do-sul.html,2024-05-06 14:03:00,Jovem Pan,A Confederação da Agricultura e Pecuária do Brasil vai doar R$ 2 milhões para ajudar os afetados pelas chuvas na região; valor será doado para o projeto “Band Abraça o Rio Grande do Sul”
496,Pedro Scooby aciona amigos e vai para o Rio Grande do Sul ajudar as vítimas das chuvas,https://jovempan.com.br/noticias/brasil/pedro-scooby-aciona-amigos-e-vai-para-o-rio-grande-do-sul-ajudar-as-vitimas-das-chuvas.html,2024-05-06 13:07:00,Jovem Pan,"Grupo de surfistas e socorristas levará alimentos, carros de grande porte e jet-skis: ‘Já estão indicando para a gente os lugares mais necessitados’"
497,Bancos adotam medidas para ajudar vítimas das chuvas no Rio Grande do Sul,https://jovempan.com.br/noticias/economia/bancos-adotam-medidas-para-ajudar-vitimas-das-chuvas-no-rio-grande-do-sul.html,2024-05-05 22:50:00,Jovem Pan,"Itaú, Bradesco, Santander, BTG Pactual, Banco do Brasil e Caixa Econômica Federal liberaram ‘saque calamidade’ do FGTS e auxílio para funcionários e familiares"
498,Papa Francisco expressa solidariedade às vítimas das enchentes no Rio Grande do Sul,https://jovempan.com.br/noticias/brasil/papa-francisco-expressa-solidariedade-as-vitimas-das-enchentes-no-rio-grande-do-sul.html,2024-05-05 21:25:00,Jovem Pan,"Chuvas já afetaram mais de 300 municípios, causando danos e deixando um rastro de destruição"
499,"Após chuvas no Rio Grande do Sul, governo articula criação de plano nacional de prevenção de tragédias climáticas",https://jovempan.com.br/noticias/brasil/apos-chuvas-no-rio-grande-do-sul-governo-planeja-criacao-de-plano-nacional-de-prevencao-de-tragedias-climaticas.html,2024-05-05 18:35:00,Jovem Pan,"Presidente anunciou medidas de socorro para o Estado e revelou que a ministra do Meio Ambiente, Marina Silva, criará estratégias para mitigar danos"
500,Chuvas no RS: FAB usa aeronave não tripulada para auxiliar no resgate,https://jovempan.com.br/noticias/brasil/chuvas-no-rs-fab-usa-aeronave-nao-tripulada-para-auxiliar-no-resgate.html,2024-05-05 15:00:00,Jovem Pan,"Comunicação entre o operador e o avião é feita por satélite, o que permite uma maior cobertura; mais de 88 mil moradores estão desalojados"
501,Prefeita de Poço das Antas dá detalhes sobre situação de cidade atingida pelas chuvas,https://jovempan.com.br/noticias/brasil/prefeita-de-poco-das-antas-da-detalhes-sobre-situacao-de-cidade-atingida-pelas-chuvas.html,2024-05-05 14:41:00,Jovem Pan,"Vânia Brackmann concedeu entrevista ao Fast News, falou sobre preocupação com possíveis deslizamentos na cidade e projetou reconstrução da cidade"
502,STF suspende prazos processuais no Rio Grande do Sul devido às enchentes,https://jovempan.com.br/noticias/brasil/stf-suspende-prazos-processuais-no-rio-grande-do-sul-devido-as-enchentes.html,2024-05-05 07:39:00,Jovem Pan,Medida visa assegurar que as partes envolvidas tenham tempo hábil para se reorganizarem diante da situação de emergência vivenciada no Estado
503,Toda a região metropolitana de Porto Alegre sofre com alagamentos,https://jovempan.com.br/noticias/brasil/toda-a-regiao-metropolitana-de-porto-alegre-sofre-com-alagamentos.html,2024-05-04 20:15:00,Jovem Pan,"Consequências se estendem por cidades vizinhas da capital gaúcha como Canoas, Esteio, Eldorado do Sul e Sapucaia"
504,Tragédia causada pelas chuvas no Rio Grande do Sul já afeta meio milhão de pessoas,https://jovempan.com.br/noticias/brasil/tragedia-causada-pelas-chuvas-no-rio-grande-do-sul-ja-afeta-meio-milhao-de-pessoas.html,2024-05-04 19:45:00,Jovem Pan,Estado tem 418 mil pontos sem energia elétrica e cerca de 1 milhão de domicílios sem abastecimento de água; Gramado e Santa Maria são as cidades mais impactadas
505,Enchente histórica em Porto Alegre afeta serviços públicos e deixa 4.000 residências sem água e luz,https://jovempan.com.br/noticias/brasil/enchente-historica-em-porto-alegre-afeta-servicos-publicos-e-deixa-4-000-residencias-sem-agua-e-luz.html,2024-05-03 20:32:00,Jovem Pan,"Rio Guaíba chegou a 4,58 metros nesta sexta-feira e inundou centro histórico da capital gaúcha; energia elétrica foi cortada por recomendação das autoridades locais"
506,Saiba como ajudar as vítimas das chuvas no Rio Grande do Sul,https://jovempan.com.br/noticias/brasil/saiba-como-ajudar-as-vitimas-das-chuvas-no-rio-grande-do-sul.html,2024-05-03 15:49:00,Jovem Pan,Autoridades e famosos reforçam campanha de doações de sangue e recursos após devastação causada pelas enchentes no Estado
507,Rio Grande do Sul já tem 39 mortos devido às intensas chuvas que atingem o Estado,https://jovempan.com.br/noticias/brasil/rio-grande-do-sul-ja-tem-37-mortos-devido-as-intensas-chuvas-que-atingem-o-estado.html,2024-05-03 15:01:00,Jovem Pan,"Estado já tem quase 8 mil pessoas em abrigos e outros 23.598 desalojados; CBF adiou partidas envolvendo times gaúchos no Brasileiro, e governo adiou as provas do Concurso Nacional Unificado (CNU)"
508,Governo adia ‘Enem dos Concursos’ devido às chuvas no Rio Grande do Sul,https://jovempan.com.br/noticias/brasil/governo-adia-enem-dos-concursos-devido-as-chuvas-no-rio-grande-do-sul.html,2024-05-03 14:30:00,Jovem Pan,"Ministério da Gestão havia informado que provas seriam mantidas mesmo no Estado, mas mudou de ideia para não prejudicar nenhum candidato; nova data deve ser informada no prazo de suas semanas"
509,"Chuvas chegam a Santa Catarina, causam estragos e deixam um morto",https://jovempan.com.br/noticias/brasil/chuvas-causam-estragos-e-deixam-morto-em-santa-catarina.html,2024-05-03 14:02:00,Jovem Pan,"Fortes chuvas em Santa Catarina deixam um morto, feridos e desabrigados. Tornado também é registrado, causando estragos"
510,CBF adia jogos de equipes gaúchas devido às fortes chuvas no Rio Grande do Sul,https://jovempan.com.br/noticias/brasil/cbf-adia-jogos-de-equipes-gauchas-devido-as-fortes-chuvas-no-rio-grande-do-sul.html,2024-05-03 13:13:00,Jovem Pan,"Medida afeta 12 jogos de diversas competições e divisões do futebol brasileiro; Estado vive situação de emergência, com 31 mortos, 74 desaparecidos e 56 feridos"
511,"Chuva no RS: Rio Guaíba ultrapassa cota de inundação, e água invade o Cais Mauá",https://jovempan.com.br/noticias/brasil/chuva-no-rs-rio-guaiba-ultrapassa-cota-de-inundacao-e-agua-invade-o-cais-maua.html,2024-05-02 18:25:00,Jovem Pan,"Defesa Civil orientou moradores de Porto Alegre, Guaíba e Eldorado do Sul, a evacuarem e buscarem abrigos públicos ou locais seguros"
512,Barragem na Serra Gaúcha se rompe devido à força da chuva e deixa cidades próximas em alerta,https://jovempan.com.br/noticias/brasil/barragem-na-serra-gaucha-rompe-devido-aos-temporais-no-rio-grande-do-sul.html,2024-05-02 15:57:00,Jovem Pan,"Colapso de estrutura no Rio das Antas elevou o nível do Rio Taquari; Defesa Civil orienta moradores de Santa Tereza, Muçum, Roca Sales, Arroio do Meio, Encantado, Colinas e Lajeado a procurarem locais seguros"
513,Eduardo Leite pede para moradores de Gramado e Canela deixarem suas casas devido ao risco de enchente,https://jovempan.com.br/noticias/brasil/eduardo-leite-pede-para-moradores-de-gramado-e-canela-deixarem-suas-casas-devido-ao-risco-de-enchente.html,2024-05-02 15:20:00,Jovem Pan,"Alerta também abrange os municípios de São Francisco de Paula, Nova Petrópolis, Vale Real e Feliz; governo do Estado decretou estado de calamidade pública"
514,Sobe para 31 o número de mortes devido às fortes chuvas no Rio Grande do Sul,https://jovempan.com.br/noticias/brasil/sobe-para-32-o-numero-de-mortes-devido-as-fortes-chuvas-no-rio-grande-do-sul.html,2024-05-02 11:13:00,Jovem Pan,"A Defesa Civil registra 29 mortes e demais foram confirmadas por prefeituras, Corpo de Bombeiros, Polícia Militar e órgãos locais; cerca de 67 mil pessoas foram atingidas pelo desastre ambiental no Rio Grande do Sul"
515,Eduardo Leite diz que Rio Grande do Sul vive pior tragédia da história e não tem capacidade para fazer todos os resgates,https://jovempan.com.br/noticias/brasil/eduardo-leite-diz-que-rio-grande-do-sul-vive-pior-tragedia-da-historia-e-nao-tem-capacidade-para-fazer-todos-os-resgates.html,2024-05-01 20:05:00,Jovem Pan,"Governador pediu socorro para o presidente Luiz Inácio Lula da Silva, dizendo que o Estado vive ‘situação de guerra’; saldo até agora é de 10 mortos, 21 desaparecidos e 11 feridos, além de mais de 3.400 desalojados"
516,FAB auxilia no resgate de pessoas ilhadas pelas enchentes no Rio Grande do Sul,https://jovempan.com.br/noticias/brasil/fab-auxilia-no-resgate-de-pessoas-ilhadas-pelas-enchentes-no-rio-grande-do-sul.html,2024-05-01 14:38:00,Jovem Pan,Dois helicópteros H-60 Black Hawk foram mobilizados para a missão humanitária; temporais no Estado já deixaram dez mortos e 21 desaparecidos
517,Fiscalização da Lei Seca flagra ‘fadas’ cobrando para ajudar motoristas na blitz,https://jovempan.com.br/noticias/brasil/fiscalizacao-da-lei-seca-flagra-fadas-cobrando-para-ajudar-motoristas-na-blitz.html,2024-04-21 22:43:00,Jovem Pan,"Flagrante foi feito por um drone operado pelos agentes da Lei Seca na Barra da Tijuca, zona oeste, no dia 14 de abril"
518,Vice-presidente da Braskem admite culpa da empresa no desastre ambiental de Maceió,https://jovempan.com.br/noticias/brasil/vice-presidente-da-braskem-admite-culpa-da-empresa-no-desastre-ambiental-de-maceio.html,2024-04-10 15:40:00,Jovem Pan,"Petroquímica fazia extração de sal-gema na capital alagoana, mas atividade resultou no afundamento do solo e, consequentemente, na evacuação de diversos bairros"
519,Chuvas em Salvador causam alagamentos e deslizamentos,https://jovempan.com.br/noticias/brasil/chuvas-em-salvador-causam-alagamentos-e-deslizamentos.html,2024-04-08 23:54:00,Jovem Pan,"Sirenes foram acionadas em 14 localidades da periferia da cidade, orientando os moradores a deixarem suas casas"
520,Espírito Santo tem ao menos 20 mil desalojados por causa das chuvas,https://jovempan.com.br/noticias/brasil/espirito-santo-tem-ao-menos-20-mil-desalojados-por-causa-das-chuvas.html,2024-03-27 17:39:00,Jovem Pan,Previsão para os próximos dias é de mais temporal; número de mortos chegou a 20
521,Espírito Santo contabiliza 19 mortos por consequência das chuvas,https://jovempan.com.br/noticias/brasil/espirito-santo-contabiliza-19-mortos-por-consequencia-das-chuvas.html,2024-03-25 18:58:00,Jovem Pan,"Estima-se que 7.287 mil pessoas estejam desalojadas, e outras 411 desabrigadas nos municípios de Apiacá, Mimoso do Sul, Vargem Alta e Bom Jesus do Norte"
522,Chuvas deixam 17 mortes no Espírito Santo,https://jovempan.com.br/noticias/brasil/chuvas-deixam-17-mortes-no-espirito-santo.html,2024-03-24 21:17:00,Jovem Pan,"Desalojados no estado são mais de 5,4 mil e desalojados, 255"
523,Sobe para 24 o número de mortos por chuvas no Rio de Janeiro e Espírito Santo,https://jovempan.com.br/noticias/brasil/sobe-para-20-o-numero-de-mortos-por-chuvas-no-rio-de-janeiro-e-espirito-santo.html,2024-03-24 10:45:00,Jovem Pan,"Inmet (Instituto Nacional de Meteorologia) prevê mais chuvas para o Sudeste do Brasil para este domingo, 24"
524,Chuvas atingem sudeste do Brasil e deixam ao menos 12 mortos,https://jovempan.com.br/noticias/brasil/chuvas-atingem-sudeste-do-brasil-e-deixam-ao-menos-12-mortos.html,2024-03-23 20:31:00,Jovem Pan,"Rio de Janeiro e Espírito Santo foram as regiões mais afetadas; estado carioca contabiliza oito vítimas fatais, enquanto o capixaba soma quatro"
525,Sobe para 8 número de mortos pelas chuvas no Rio; Petrópolis decreta emergência,https://jovempan.com.br/noticias/brasil/sobe-para-7-numero-de-mortos-pelas-chuvas-no-rio-petropolis-decreta-emergencia.html,2024-03-23 11:46:00,Jovem Pan,"De acordo com a Defesa Civil de Petrópolis, já foram registrados 75 deslizamentos no município; previsão para este sábado é de mais chuva na Baixada Fluminense"
526,"Deslizamentos deixam 3 mortos e 2 desaparecidos em Petrópolis, no Rio",https://jovempan.com.br/noticias/brasil/deslizamentos-deixam-3-mortos-e-2-desaparecidos-em-petropolis-no-rio.html,2024-03-22 20:42:00,Jovem Pan,"A chuva já causou 75 deslizamentos de terra em Petrópolis, na Região Serrana, até o início da noite"
527,"Chuva na região serrana do Rio pode ter mesmo volume que causou tragédia em 2011, alerta Cemaden",https://jovempan.com.br/noticias/brasil/chuva-na-regiao-serrana-do-rio-pode-ter-mesmo-volume-que-causou-tragedia-em-2011-alerta-cemaden.html,2024-03-22 19:16:00,Jovem Pan,"Neste fim de semana, RJ deve enfrentar temporais com acumulados superiores a 200 milímetros por dia"
528,Petrópolis está em estado de alerta após chuvas intensas,https://jovempan.com.br/noticias/brasil/petropolis-esta-em-estado-de-alerta-apos-chuvas-intensas.html,2024-03-22 18:29:00,Jovem Pan,Sistema de sirenes da cidade foi acionado para alertar a população sobre a situação
529,"Por risco de tempestades, Parque da Ciência, no Butantan, estará fechado neste sábado",https://jovempan.com.br/noticias/brasil/por-risco-de-tempestades-parque-da-ciencia-no-butantan-estara-fechado-neste-sabado.html,2024-03-22 15:27:00,Jovem Pan,"Ingressos que foram previamente adquiridos poderão ser utilizados em data futura, sem prejuízos para os visitantes, segundo o Butantan"
530,Cidade do Rio decreta ponto facultativo por previsão de chuva forte,https://jovempan.com.br/noticias/brasil/cidade-do-rio-decreta-ponto-facultativo-por-previsao-de-chuva-forte.html,2024-03-22 08:51:00,Jovem Pan,Objetivo é reduzir circulação de pessoas na capital
531,"Chuva provoca estragos, alagamentos e deslizamento de terra no Estado de São Paulo e deixa uma pessoa morta",https://jovempan.com.br/noticias/brasil/chuva-provoca-estragos-alagamentos-e-deslizamento-de-terra-no-estado-de-sao-paulo-e-deixa-uma-pessoa-morta.html,2024-03-10 15:57:00,Jovem Pan,Jovem de 20 anos foi levada pela enxurrada na cidade de Brotas; bombeiros encontraram o corpo dela neste domingo
532,Inmet emite alerta de tempestade para Sul do Brasil e chuvas no Nordeste,https://jovempan.com.br/noticias/brasil/inmet-emite-alerta-de-tempestade-para-sul-do-brasil-e-chuvas-no-nordeste.html,2024-03-09 09:24:00,Jovem Pan,"Regiões enfrentam possibilidade de granizo, ventos fortes e riscos de danos; Rio e São Paulo podem ter chuvas fracas"
533,Inmet alerta para perigo de chuva forte em todo o Brasil nesta sexta-feira,https://jovempan.com.br/noticias/brasil/inmet-alerta-para-perigo-de-chuva-forte-em-todo-o-brasil-nesta-sexta-feira.html,2024-03-08 07:50:00,Jovem Pan,"Segundo o instituto, o país deve enfrentar temporais até 11 de março; há risco de corte de energia, queda de galhos de árvores e alagamentos"
534,Inmet emite alerta de chuvas intensas em todo o Brasil,https://jovempan.com.br/noticias/brasil/inmet-emite-alerta-de-chuvas-intensas-em-todo-o-brasil.html,2024-03-07 11:30:00,Jovem Pan,"Aviso aponta risco de corte de energia elétrica, queda de galhos de árvores e alagamentos"
