Unnamed: 0,titulo,link,data,site,descricao
274,Governo do RJ anuncia R$ 8 bilhões para prevenção contra desastres causados pelas chuvas,https://jovempan.com.br/noticias/brasil/governo-do-rj-anuncia-r-8-bilhoes-para-prevencao-contra-desastres-causados-pelas-chuvas.html,2025-01-16 17:10:00,Jovem Pan,"Governador Cláudio Castro apresentou um plano de contingência abrangente que inclui não apenas a realização de obras, mas também o fortalecimento de maquinário e equipes"
275,Estado de São Paulo deve ter chuvas intensas nesta quarta-feira,https://jovempan.com.br/programas/jornal-da-manha/previsao-do-tempo-indica-mudanca-no-clima-com-chuvas-isoladas-a-tarde.html,2025-01-15 08:16:00,Jovem Pan,"Capital paulista amanheceu sob forte nebulosidade, condição que se estende por todo o estado; circulação de ventos em médios níveis da atmosfera está provocando chuvas fortes em algumas áreas do Brasil"
276,Inmet emite alerta para chuvas intensas até quarta em diversas regiões do Brasil,https://jovempan.com.br/noticias/brasil/inmet-emite-alerta-para-chuvas-intensas-ate-quarta-em-diversas-regioes-do-brasil.html,2025-01-14 20:09:00,Jovem Pan,"Entre os locais afetados estão Rondônia, Mato Grosso, Mato Grosso do Sul, Goiás, além de Minas Gerais, Bahia, Sergipe, Alagoas, Paraíba, Pernambuco, Rio Grande do Norte, Ceará, Pará, Piauí, Maranhão, Tocantins e o Distrito Federal"
277,Número de mortos sobe para 11 após deslizamentos de terra em Ipatinga (MG),https://jovempan.com.br/noticias/brasil/numero-de-mortos-sobe-para-11-apos-deslizamentos-de-terra-em-ipatinga-mg.html,2025-01-13 14:44:00,Jovem Pan,"Ao todo, 150 pessoas ficaram desalojadas na região, de acordo com informações da prefeitura da cidade"
278,Prefeitura de Ipatinga anuncia auxílio para moradores afetados pelas chuvas,https://jovempan.com.br/noticias/brasil/prefeitura-de-ipatinga-anuncia-auxilio-para-moradores-afetados-pelas-chuvas.html,2025-01-12 23:22:00,Jovem Pan,"Benefício estará sujeito a critérios sociais ainda não detalhados; temporal na cidade mineira causou deslizamentos de terra e provocou ao menos dez mortes, incluindo duas crianças;"
279,"Rodovia se rompe após chuvas em Sergipe, engole carros e deixa ao menos três mortos",https://jovempan.com.br/noticias/brasil/rodovia-se-rompe-apos-chuvas-em-sergipe-engole-carros-e-deixa-ao-menos-tres-mortos.html,2025-01-12 15:59:00,Jovem Pan,"Dois veículos foram arrastados para o buraco que se abriu na estrada, mas o motorista de um deles consegui se salvar; o outro automóvel submergiu com duas mulheres e um homem"
280,Temporal em Ipatinga (MG) causa deslizamentos e deixa ao menos nove mortos,https://jovempan.com.br/noticias/brasil/temporal-em-ipatinga-mg-causa-deslizamentos-e-deixa-ao-menos-cinco-mortos.html,2025-01-12 14:15:00,Jovem Pan,"Além das vítimas, uma pessoa permanece desaparecida; em resposta à calamidade, prefeitura declarou estado de emergência por um período de seis meses"
281,"Após tragédia no Rio Tocantins, senador cobra agilidade em obras para recuperação de pontes",https://jovempan.com.br/noticias/brasil/apos-tragedia-no-rio-tocantins-senador-cobra-agilidade-em-obras-para-recuperacao-de-pontes.html,2025-01-11 08:00:00,Jovem Pan,"Wellington Fagundes, presidente da Frente Parlamentar Mista de Logística, sugeriu a implementação de desvios e balsas para garantir o tráfego na região"
282,Peruíbe decreta estado de emergência após fortes chuvas,https://jovempan.com.br/programas/jornal-da-manha/peruibe-decreta-estado-de-emergencia-apos-fortes-chuvas.html,2025-01-10 14:38:00,Jovem Pan,"De acordo com a Defesa Civil, 442 pessoas estão desalojadas, com 137 famílias sendo temporariamente abrigadas em escolas municipais"
283,"Inmet emite alerta laranja para chuvas intensas em São Paulo, Paraná e Rio de Janeiro",https://jovempan.com.br/noticias/brasil/inmet-emite-alerta-laranja-para-chuvas-intensas-em-sao-paulo-parana-e-rio-de-janeiro.html,2025-01-10 13:46:00,Jovem Pan,"Aviso destaca os riscos de alagamentos, deslizamentos de terra, transbordamentos de rios e precipitações que podem variar entre 50 e 100 mm por dia"
284,Chuvas fortes devem atingir Centro-Sul do Brasil nesta sexta,https://jovempan.com.br/programas/jornal-da-manha/chuvas-fortes-devem-atingir-centro-sul-do-brasil-nesta-sexta.html,2025-01-10 08:13:00,Jovem Pan,"Há a possibilidade de precipitações superiores a 100 mm, o que gera preocupações para locais que já enfrentam altos volumes de chuva, como Minas Gerais e Espírito Santo"
285,Chuvas em MG: Dom Silvério enfrenta a pior enchente em quatro anos e deixa mais de 100 desalojados,https://jovempan.com.br/noticias/brasil/chuvas-em-mg-dom-silverio-enfrenta-a-pior-enchente-em-quatro-anos-e-deixa-mais-de-100-desalojados.html,2025-01-09 19:16:00,Jovem Pan,"Prefeito ressaltou que muitas famílias enfrentaram a perda total de seus bens; me um curto período de 20 minutos, a precipitação alcançou aproximadamente 150 mm, resultando no transbordamento de um córrego"
286,Fortes chuvas no litoral paulista deixam mais de 200 desabrigados em Peruíbe,https://jovempan.com.br/noticias/brasil/fortes-chuvas-no-litoral-paulista-deixam-mais-de-200-desabrigados-em-peruibe.html,2025-01-09 13:01:00,Jovem Pan,"Total acumulado desde quarta-feira foi de 244 mm; tempestades também causaram estragos em Ubatuba, na parte norte da costa paulista"
287,Sudeste terá pancadas de chuva no fim da tarde desta quarta,https://jovempan.com.br/noticias/brasil/sudeste-tera-pancadas-de-chuva-no-fim-da-tarde-desta-quarta.html,2025-01-08 08:16:00,Jovem Pan,"Com temperaturas altas durante o dia, precipitações volta pelo fim da tarde em grande parte da região; meteorologia alerta para a necessidade de atenção redobrada devido às condições climáticas, que embora típicas do verão, podem causar transtornos significativos"
288,Teto de supermercado em São Caetano desaba durante a chuva,https://jovempan.com.br/noticias/brasil/teto-de-supermercado-em-sao-caetano-desaba-durante-a-chuva.html,2025-01-07 19:44:00,Jovem Pan,"Estrutura colapsou sobre alguns veículos e não houve registro de feridos; Defesa Civil da região reportou ventos que chegaram a atingir 65 km/h, além de receber chamadas relacionadas a quedas de árvores"
289,Previsão do tempo alerta chances de chuva no Centro-Oeste e Sudeste nesta terça,https://jovempan.com.br/programas/jornal-da-manha/previsao-do-tempo-alerta-chances-de-chuva-no-centro-oeste-e-sudeste-nesta-terca.html,2025-01-07 08:29:00,Jovem Pan,"Com temperatura máxima de 28ºC em São Paulo, clima abafado e com precipitações deve persistir nas próximas semanas de verão"
290,Defesa Civil alerta para chuvas intensas e ventos fortes em São Paulo,https://jovempan.com.br/noticias/brasil/defesa-civil-alerta-para-chuvas-intensas-e-ventos-fortes-em-sao-paulo.html,2025-01-04 10:30:00,Jovem Pan,"Preocupação com deslizamentos de terra é crescente, especialmente em áreas vulneráveis como a Grande São Paulo, Vale do Paraíba e litoral"
291,"Ponte Provisória em Feliz, RS, é arrastada por chuvas intensas",https://jovempan.com.br/noticias/brasil/ponte-provisoria-em-feliz-rs-e-arrastada-por-chuvas-intensas.html,2025-01-03 22:37:00,Jovem Pan,"Prefeito Júnior Freiberger divulgou um vídeo confirmando a destruição da estrutura, que era a única rota para veículos pesados entre Picada Cará e o bairro Arroio Feliz, gerando sérios problemas de tráfego"
292,"Chuva de meteoros, eclipse e superlua: saiba quando vão acontecer os eventos astronômicos de 2025",https://jovempan.com.br/noticias/brasil/chuva-de-meteoros-eclipse-e-superlua-saiba-quando-vao-acontecer-os-eventos-astronomicos-de-2025.html,2025-01-01 21:50:00,Jovem Pan,"Entre esses fenômenos, a chuva de meteoros Quadrântidas se destaca como a primeira grande exibição do ano, que acontecerá entre os dias 3 e 4 de janeiro"
293,Defesa Civil alerta para riscos de tempestades em São Paulo,https://jovempan.com.br/programas/jornal-da-manha/defesa-civil-alerta-para-riscos-de-tempestades-em-sao-paulo.html,2024-12-31 09:18:00,Jovem Pan,"Com a chegada do verão, a presença chuvas típicas são intensificadas ao longo dos próximos dias em todo estado; precipitações podem vir acompanhadas de ventos, granizos e raios"
294,"Cavalo Caramelo, símbolo das enchentes do RS, protagoniza chamada da série ‘Yellowstone’",https://jovempan.com.br/noticias/brasil/cavalo-caramelo-simbolo-das-enchentes-do-rs-protagoniza-chamada-da-serie-yellowstone.html,2024-12-30 19:32:00,Jovem Pan,"A campanha, que visa promover as novas temporadas da produção sobre a família Dutton em Montana, destaca que ‘o cavalo que viveu uma vida de desafios tem espírito Yellowstoner em sua alma’; assista ao vídeo"
295,São Paulo tem previsão de chuva forte com vento e granizo,https://jovempan.com.br/noticias/brasil/sao-paulo-tem-previsao-de-chuva-forte-vento-e-granizo.html,2024-12-30 17:42:00,Jovem Pan,"A tempestade atingiu a zona leste da capital, alcançando municípios da região metropolitana, como Caieiras, Franco da Rocha, Francisco Morato e Guarulhos; em Barueri, teto de um mercado desabou com a tempestade"
296,Teto de supermercado desaba em Barueri após forte chuva com granizo,https://jovempan.com.br/noticias/brasil/teto-de-mercado-desaba-em-barueri-apos-chuva-forte-com-granizo.html,2024-12-30 16:49:00,Jovem Pan,"Ao menos duas pessoas ficaram feridas no incidente da tarde desta segunda-feira (30); as vítimas foram encontradas fora dos escombros, e o Corpo de Bombeiros foi acionado às 14h30"
297,Há 92% de chance de chuva na véspera de ano-novo em SP,https://jovempan.com.br/noticias/brasil/ha-92-de-chance-de-chuva-na-vespera-de-ano-novo-em-sp.html,2024-12-29 07:40:00,Jovem Pan,"De acordo com previsão do Climatempo, sistema meteorológico será marcado por alta nebulosidade nos próximos dias; são esperados acumulados de precipitações superiores a 100 milímetros, podendo chegar a até 150 em algumas regiões"
298,"Chuvas provocam deslizamentos e deixam 40 pessoas desalojadas em Santa Isabel, na Grande SP",https://jovempan.com.br/noticias/brasil/chuvas-provocam-deslizamentos-e-deixam-40-pessoas-desalojadas-em-santa-isabel-na-grande-sp.html,2024-12-28 20:14:00,Jovem Pan,"Cidade lidera o acumulado de precipitação no Estado, com 199 milímetros registrados nas últimas 72 horas"
299,Deslizamento de terra em Taubaté deixa três mortos,https://jovempan.com.br/noticias/brasil/deslizamento-de-terra-em-taubate-deixa-tres-mortos.html,2024-12-28 13:10:00,Jovem Pan,"Operações de busca e resgate se estenderam por mais de sete horas, mobilizando nove viaturas do Corpo de Bombeiros e outras equipes de emergência"
300,Estado do Rio de Janeiro pode ter chuva de 400 milímetros e deslizamentos de terra no final do ano e começo de 2025,https://jovempan.com.br/noticias/brasil/estado-do-rio-de-janeiro-pode-ter-chuva-de-400-milimetros-e-deslizamentos-de-terra-no-final-do-ano-e-comeco-de-2025.html,2024-12-28 10:49:00,Jovem Pan,"Previsões meteorológicas indicam que as chuvas mais intensas devem ocorrer neste fim de semana, com continuidade prevista para a segunda-feira"
301,São Paulo tem previsão de chuva para último final de semana do ano,https://jovempan.com.br/noticias/brasil/sao-paulo-tem-previsao-de-chuva-para-ultimo-final-de-semana-do-ano.html,2024-12-28 10:23:00,Jovem Pan,Clima instável é resultado do fluxo de ar quente e úmido que se desloca pelo Brasil
302,Defesa Civil de Minas Gerais confirma oito mortes por causa das chuvas,https://jovempan.com.br/noticias/brasil/defesa-civil-de-minas-gerais-confirma-oito-mortes-por-causa-das-chuvas.html,2024-12-27 23:22:00,Jovem Pan,"Vítimas mais recentes são um casal que desapareceu durante as chuvas na cidade de Raul Soares, localizada na Zona da Mata"
303,"Após alagamentos e transtornos, São Paulo tem alerta de chuva forte nesta quinta-feira e na sexta",https://jovempan.com.br/noticias/brasil/apos-alagamentos-e-transtornos-sao-paulo-tem-alerta-de-chuva-forte-nesta-quinta-feira-e-na-sexta.html,2024-12-26 10:41:00,Jovem Pan,"Segundo o Centro de Gerenciamento de Emergências, da Prefeitura, a chegada de uma frente fria ao Estado, associada ao canal de umidade da região centro-norte do País, vai provocar volumes expressivos de precipitação"
304,Defesa Civil de SP emite primeiro alerta sonoro sobre chuvas intensas em Campinas,https://jovempan.com.br/noticias/brasil/defesa-civil-de-sp-emite-primeiro-alerta-sonoro-sobre-chuvas-intensas-em-campinas.html,2024-12-26 09:54:00,Jovem Pan,"Em comunicado, o órgão comentou que a medida representa um ‘marco histórico’ para a força"
305,Chuva alaga ruas de São Paulo e deixa mais de 40 mil imóveis sem luz no Natal,https://jovempan.com.br/noticias/brasil/chuva-alaga-ruas-de-sao-paulo-e-deixa-mais-de-30-mil-imoveis-sem-luz-no-natal.html,2024-12-25 19:29:00,Jovem Pan,"Além da capital, a Grande São Paulo e cidades como Bauru, Araçatuba e Santos também foram impactadas; combinação de calor e umidade foi um fator que contribuiu para as precipitações"
306,CGE alerta para chuvas fortes em São Paulo durante o dia de Natal,https://jovempan.com.br/noticias/brasil/cge-alerta-para-chuvas-fortes-em-sao-paulo-durante-o-dia-de-natal.html,2024-12-25 07:11:00,Jovem Pan,"Tempestades devem persistir ao longo da última semana de dezembro, em decorrência da formação da primeira Zona de Convergência do Atlântico Sul  deste verão"
307,Dnit revisará inspeções de pontes federais após tragédia no Rio Tocantins,https://jovempan.com.br/noticias/brasil/dnit-revisara-inspecoes-de-pontes-federais-apos-tragedia-no-rio-tocantins.html,2024-12-24 16:04:00,Jovem Pan,"Uma das principais mudanças será a diminuição do intervalo entre as verificações, que atualmente ocorrem a cada um ano e meio"
308,Grande São Paulo tem ao menos 60 mil imóveis sem energia após chuvas intensas,https://jovempan.com.br/noticias/brasil/grande-sao-paulo-tem-55-mil-imoveis-sem-energia-apos-chuvas-intensas.html,2024-12-22 10:24:00,Jovem Pan,"Ribeirão Pires é a localidade mais atingida, contabilizando 2.503 interrupções no fornecimento.; condições climáticas severas, que incluíram ventos fortes, resultaram na queda de árvores e galhos"
309,Acidente em Minas Gerais é a maior tragédia em rodovias federais desde 2007,https://jovempan.com.br/noticias/brasil/acidente-em-minas-gerais-e-a-maior-tragedia-em-rodovias-federais-desde-2007.html,2024-12-21 15:41:00,Jovem Pan,"Ônibus da empresa ENTRAM perdeu o controle após um pneu estourar neste sábado (21); veículo colidiu com carreta carregada de pedras e saiu da pista, pegando fogo"
310,Grande São Paulo ainda tem 320 mil residências sem luz em decorrência das chuvas,https://jovempan.com.br/noticias/brasil/grande-sao-paulo-ainda-tem-320-mil-residencias-sem-luz-em-decorrencia-das-chuvas.html,2024-12-21 10:42:00,Jovem Pan,"Enel, responsável pela distribuição de energia, relatou que 3,8% de seus clientes estão sem luz, enquanto 340 mil já tiveram o fornecimento restabelecido"
311,Rio de Janeiro tem chuvas intensas e ventos fortes nesta sexta-feira (20),https://jovempan.com.br/noticias/brasil/rio-de-janeiro-tem-chuvas-intensas-e-ventos-fortes-nesta-sexta-feira-20.html,2024-12-20 20:24:00,Jovem Pan,"Sistema de monitoramento Alerta Rio emitiu avisos sobre a possibilidade de chuvas que variam de moderadas a fortes, além de relâmpagos e rajadas de vento"
312,Árvore de Natal flutuante cai em Maricá e mata um funcionário durante tempestade,https://jovempan.com.br/programas/jornal-da-manha/arvore-de-natal-flutuante-cai-em-marica-e-mata-um-funcionario-durante-tempestade.html,2024-12-17 13:51:00,Jovem Pan,Outras duas pessoas ficaram feridas após queda da estrutura de 56 metros; Defesa Civil havia emitido alertado sobre chuvas fortes no local
313,Brasil bate recorde de áreas queimadas em 2024,https://jovempan.com.br/noticias/brasil/brasil-bate-recorde-de-areas-queimadas-em-2024.html,2024-12-16 12:54:00,Jovem Pan,"Total de 29,7 milhões de hectares queimados representa um crescimento de 90% em relação a 2023; Amazônia foi a mais afetada, com 16,9 milhões de hectares"
314,Avião da Gol faz pouso de emergência na Base Aérea de Canoas durante Ciclone Biguá,https://jovempan.com.br/noticias/brasil/aviao-da-gol-faz-pouso-de-emergencia-na-base-aerea-de-canoas-durante-ciclone-bigua.html,2024-12-16 10:52:00,Jovem Pan,"Apesar do susto, a aeronave conseguiu aterrissar com segurança, embora tenha registrado um atraso de 28 minutos"
315,Previsão do tempo indica chuva no Sul e no Sudeste nesta segunda,https://jovempan.com.br/programas/jornal-da-manha/previsao-do-tempo-emite-alerta-de-chuva-para-sul-e-sudeste-nesta-segunda.html,2024-12-16 08:01:00,Jovem Pan,"Ciclone extratropical que passou pelo Rio Grande do Sul causou fortes temporais no Estado; em São Paulo, Rio de Janeiro e Minas Gerais também há expectativa de possíveis precipitações"
316,Rio Grande do Sul tem alerta para ciclone subtropical,https://jovempan.com.br/noticias/brasil/rio-grande-do-sul-tem-alerta-para-ciclone-subtropical.html,2024-12-15 09:19:00,Jovem Pan,"De acordo com Instituto Nacional de Meteorologia (Inmet), a região do litoral e interior do sul gaúcho tem previsão de tempestades neste domingo; temporais podem apresentar um volume maior que 100 mm/dia, e com ventos superiores a 100 km/h"
317,Chuvas dominam maior parte do Brasil nesta sexta,https://jovempan.com.br/programas/jornal-da-manha/chuvas-dominam-maior-parte-do-brasil-nesta-sexta.html,2024-12-13 08:45:00,Jovem Pan,Primavera continua a trazer temperaturas elevadas e precipitações mais intensas durante a tarde
318,Chuvas permanecem no Centro-Sul do Brasil,https://jovempan.com.br/programas/jornal-da-manha/chuvas-permanecem-no-centro-sul-do-brasil.html,2024-12-12 09:09:00,Jovem Pan,Temperaturas elevam na capital paulista com máxima de 27°C; há alertas intensos de precipitações apenas no Espírito Santo onde terá uma frente fria que leva umidade para a região
319,Chuvas no Paraná causam deslizamentos e bloqueio de estradas,https://jovempan.com.br/programas/jornal-da-manha/chuvas-no-parana-causam-deslizamentos-e-bloqueio-de-estradas.html,2024-12-11 13:51:00,Jovem Pan,"De acordo com último boletim da Defesa Civil do Paraná, 40 cidades foram atingidas pelos temporais e cerca de 45.000 pessoas foram diretamente afetadas pelas condições climáticas"
320,"Cavalo Caramelo, símbolo das enchentes do RS, é adotado por universidade",https://jovempan.com.br/noticias/brasil/cavalo-caramelo-simbolo-das-enchentes-do-rs-e-adotado-por-universidade.html,2024-12-10 18:20:00,Jovem Pan,O animal havia sido resgatado em maio deste ano após ser encontrado em um telhado na cidade de Canoas e recebeu tratamento intensivo no Hospital Veterinário da Ulbra
321,Chuvas e frente fria se aproximam da região Sudeste,https://jovempan.com.br/programas/jornal-da-manha/chuvas-e-frente-fria-se-aproximam-da-regiao-sudeste.html,2024-12-10 09:04:00,Jovem Pan,"A região metropolitana de São Paulo deve permanecer em alerta para precipitações ao longo do dia; máxima não ultrapassa os 25ºC, o que mostra uma queda da temperatura em relação aos dias anteriores"
322,Chuvas fortes no Paraná causam estragos e aumentam vazão das Cataratas do Iguaçu,https://jovempan.com.br/noticias/brasil/chuvas-fortes-no-parana-causam-estragos-e-aumentam-vazao-das-cataratas-do-iguacu.html,2024-12-09 23:35:00,Jovem Pan,"Cataratas do Iguaçu, um dos principais pontos turísticos da região, apresentaram uma vazão impressionante, atingindo 7,84 milhões de litros de água por segundo, um volume cinco vezes superior ao habitual"
323,Semana inicia quente no Centro-Sul com alerta de chuvas no Paraná,https://jovempan.com.br/noticias/brasil/semana-inicia-quente-no-centro-sul-com-alerta-de-chuvas-no-parana.html,2024-12-09 07:58:00,Jovem Pan,"São Paulo continua com o clima abafado do fim de semana, mas há previsão de chuvas generalizadas na cidade com temperaturas chegando aos 30ºC"
324,Deslizamento em mina tira 79 pessoas de suas casas em Conceição do Pará,https://jovempan.com.br/noticias/brasil/deslizamento-em-mina-tira-79-pessoas-de-suas-casas-em-conceicao-do-para.html,2024-12-08 20:38:00,Jovem Pan,"Atividades foram suspensas e o local sofreu interdição; o ministro de Minas e Energia, Alexandre Silveira, pediu uma fiscalização rigorosa"
325,"Chuvas em Santa Catarina causam alagamentos, adiam vestibular e obrigam moradores a deixar suas casas",https://jovempan.com.br/noticias/brasil/chuva-em-santa-catarina-causa-alagamentos-adia-vestibular-e-faz-moradores-deixarem-casas.html,2024-12-07 18:15:00,Jovem Pan,"Áreas mais atingidas foram o extremo oeste, o litoral norte, o planalto norte e o Vale do Itajaí; Defesa Civil orienta a população a evitar áreas propensas a alagamentos e encostas instáveis"
326,Temporal causa alagamentos e deixa um morto em São Paulo,https://jovempan.com.br/programas/jornal-da-manha/temporal-causa-alagamentos-e-deixa-um-morto-em-sao-paulo.html,2024-12-06 09:30:00,Jovem Pan,Vídeo que circula nas redes sociais capturou o momento em que homem é arrastado pela correnteza
327,Sul do Brasil entra em alerta para chuvas intensas nesta sexta,https://jovempan.com.br/noticias/brasil/sul-do-brasil-entra-em-alerta-para-chuvas-intensas-nesta-sexta.html,2024-12-06 08:52:00,Jovem Pan,"Atuação de vários sistemas meteorológicos, incluindo uma frente fria, um sistema de baixa pressão e ventos quentes vindos do Norte contribuem para a previsão de fortes precipitações"
328,Praia de Copacabana enfrenta nova contaminação por esgoto após chuvas intensas,https://jovempan.com.br/noticias/brasil/praia-de-copacabana-enfrenta-nova-contaminacao-por-esgoto-apos-chuvas-intensas.html,2024-12-04 19:17:00,Jovem Pan,"Frequentadores do local têm notado que a água poluída se espalha sempre que há precipitações, acompanhada de um odor desagradável"
329,Sudeste deve ter chuvas intensas nesta quarta-feira,https://jovempan.com.br/noticias/brasil/sudeste-deve-ter-chuvas-intensas-nesta-quarta-feira.html,2024-12-04 11:40:00,Jovem Pan,Possíveis precipitações são causadas por uma frente fria estacionada que está associada a um ciclone extratropical
330,Centro-Sul deve ter chuva acima da média em dezembro,https://jovempan.com.br/noticias/brasil/centro-sul-deve-ter-chuva-acima-da-media-em-dezembro.html,2024-12-02 14:50:00,Jovem Pan,"Previsão do início do mês indica precipitações acima da média em várias regiões do país; capital paulista pode atingir uma máxima de 30ºC nesta segunda, com possibilidade de temporais à tarde e tempo abafado"
331,Inmet alerta para chuvas intensas em diversos Estados para os próximos dias,https://jovempan.com.br/noticias/brasil/inmet-alerta-para-chuvas-intensas-em-diversos-estados-para-os-proximos-dias.html,2024-12-01 08:52:00,Jovem Pan,"Instituto emitiu alerta laranja sinalizando precipitações que podem alcançar até 100 mm por dia, acompanhadas de ventos fortes que podem chegar a 100 km/h"
332,Salvador enfrenta crise com 606 incidentes em 72 horas de chuvas intensas,https://jovempan.com.br/noticias/brasil/salvador-enfrenta-crise-com-606-incidentes-em-72-horas-de-chuvas-intensas.html,2024-11-29 16:41:00,Jovem Pan,"Entre os eventos registrados, destacam-se 321 deslizamentos de terra, 141 situações de risco de deslizamento e 144 ameaças de desabamento"
333,Mais de 27 mil pessoas ficam sem energia elétrica após tempestade em São Paulo,https://jovempan.com.br/programas/jornal-da-manha/mais-de-27-mil-pessoas-ficam-sem-energia-eletrica-apos-tempestades-em-sao-paulo.html,2024-11-29 07:50:00,Jovem Pan,"De acordo com a Enel, áreas mais atingidas foram a zona sul e oeste da capital paulista"
334,Influenciadora morre em Uberlândia após ser arrastada pela enchente,https://jovempan.com.br/noticias/brasil/influenciadora-morre-em-uberlandia-apos-ser-arrastada-pela-enchente.html,2024-11-24 18:11:00,Jovem Pan,"Jeniffer Soares Martins, de 28 anos, foi arrastada pela força das águas após sair de um veículo, ao lado de seu marido, em busca de abrigo"
335,Centro-Oeste e Sudeste devem ter chuva forte nesta quinta,https://jovempan.com.br/noticias/brasil/centro-oeste-e-sudeste-devem-ter-chuva-forte-nesta-quinta.html,2024-11-21 08:52:00,Jovem Pan,"Dia começa com um céu mais fechado; São Paulo tem máxima prevista de 25ºC, e não deve esfriar"
336,Aeroporto de Congonhas retoma operações após 112 voos cancelados devido às fortes chuvas,https://jovempan.com.br/noticias/brasil/aeroporto-de-congonhas-retoma-operacoes-apos-112-voos-cancelados-devido-as-fortes-chuvas.html,2024-11-09 11:55:00,Jovem Pan,"Neste sábado, cenário é de normalidade, em contraste com o caos da última quinta (7) e sexta-feira (8), quando passageiros enfrentaram longas filas e pernoitaram no saguão"
337,Ciclone bomba se forma no Oceano Atlântico e pode atingir o Sul do Brasil na próxima semana,https://jovempan.com.br/noticias/brasil/ciclone-bomba-se-forma-no-oceano-atlantico-e-pode-atingir-o-sul-do-brasil-na-proxima-semana.html,2024-11-08 14:45:00,Jovem Pan,"Fenômeno meteorológico é esperado para trazer chuvas fortes e ventos intensos, especialmente na terça-feira (12)"
338,Inmet emite alerta de perigo para chuvas intensas em São Paulo,https://jovempan.com.br/programas/jornal-da-manha/inmet-emite-alerta-de-perigo-para-chuvas-intensas-em-sao-paulo.html,2024-11-08 09:07:00,Jovem Pan,"Desde quinta-feira (7), região tem enfrentado condições climáticas adversas causadas pela passagem de uma frente fria"
