Unnamed: 0,titulo,link,data,site,descricao
672,"Ciclone coloca Rio Grande do Sul e parte de Santa Catarina em grande perigo, alerta Inmet",https://jovempan.com.br/noticias/brasil/ciclone-coloca-rio-grande-do-sul-e-parte-de-santa-catarina-em-grande-perigo-alerta-inmet.html,2023-07-13 00:01:00,Jovem Pan,"CENAD informou no fim desta quarta-feira que três ficaram feridos, 14 estão desalojados e nove desabrigados no Rio Grande do Sul"
673,Ciclone no Sul pode trazer ventos de até 90 km/h em SP e derrubar a temperatura no Estado,https://jovempan.com.br/noticias/brasil/ciclone-no-sul-pode-trazer-ventos-de-ate-90-km-h-em-sp-e-derrubar-a-temperatura-no-estado.html,2023-07-12 22:20:00,Jovem Pan,"Fenômeno deve ocorrer entre quinta-feira, 13, e sexta-feira, 14, quando o frio deve ter mais intensidade"
674,"Ciclone que atinge o Sul tem expectativa de ventos acima de 100 km/h, alerta capitão da Defesa Civil",https://jovempan.com.br/programas/jornal-da-manha/ciclone-que-atinge-o-sul-tem-expectativa-de-ventos-acima-de-100-km-h-alerta-capitao-da-defesa-civil.html,2023-07-12 11:03:00,Jovem Pan,"Fenômeno começara a se formar na madrugada desta quarta-feira, 12, entre o Paraguai e a Argentina, e deverá atingir o Brasil no período da tarde"
675,Ministros anunciam recursos para municípios afetados pelas chuvas em Alagoas,https://jovempan.com.br/programas/jornal-da-manha/ministros-anunciam-recursos-para-municipios-afetados-pelas-chuvas-em-alagoas.html,2023-07-12 07:42:00,Jovem Pan,Autoridades disseram que orientação do presidente Lula é de prestar todo apoio necessário
676,"Ciclone que atingirá o Sul deve ser mais intenso que o do mês passado, alerta Defesa Civil",https://jovempan.com.br/noticias/brasil/ciclone-que-atingira-o-sul-deve-ser-mais-intenso-que-o-do-mes-passado-alerta-defesa-civil.html,2023-07-11 19:15:00,Jovem Pan,"Fenômeno deve chegar ao Brasil na tarde desta quarta-feira, 12, e provocará forte ventania, além de chuvas nos estados da região"
677,"Chuvas em Alagoas e Pernambuco invadem casas, deixam um morto e atingem mais de 25 mil pessoas",https://jovempan.com.br/noticias/brasil/chuvas-em-alagoas-e-pernambuco-invadem-casas-deixam-um-morto-e-atingem-mais-de-25-mil-pessoas.html,2023-07-10 20:36:00,Jovem Pan,Uma pessoa faleceu no município de Joaquim Gomes; mais de 21  mil pessoas estão dasalojadas
678,Pernambuco e Alagoas somam 41 municípios em situação de emergência por chuvas,https://jovempan.com.br/noticias/brasil/pernambuco-e-alagoas-somam-41-municipios-em-situacao-de-emergencia-por-chuvas.html,2023-07-09 15:01:00,Jovem Pan,"Número de pessoas afetadas é superior a 24 mil, conforme dados divulgados pela Defesa Civil de cada Estado"
679,Alagoas decreta emergência em 29 cidades após chuvas; prefeita é criticada por foto em enchente,https://jovempan.com.br/noticias/brasil/alagoas-decreta-emergencia-em-29-cidades-apos-chuvas-prefeita-e-criticada-por-foto-em-enchente.html,2023-07-08 19:36:00,Jovem Pan,"De acordo com o último balanço da Defesa Civil, uma pessoa morreu e outras 16.424 foram afetadas pelas chuvas até o momento"
680,"Nos 15 anos da Lei Seca, Detran-SP registra recorde no número de fiscalizações",https://jovempan.com.br/noticias/brasil/nos-15-anos-da-lei-seca-detran-sp-registra-recorde-no-numero-de-fiscalizacoes.html,2023-07-06 16:56:00,Jovem Pan,"Com 25.850 mil veículos abordados, índice cresceu 28% em relação ao mês de maio, de acordo com dados obtidos pelo site da Jovem Pan"
681,Ciclone se forma no litoral do Sudeste e sobe para o Nordeste; saiba o que pode acontecer,https://jovempan.com.br/noticias/brasil/ciclone-se-forma-no-litoral-do-sudeste-e-sobe-para-o-nordeste-saiba-o-que-pode-acontecer.html,2023-07-03 16:03:00,Jovem Pan,"Com deslocamento do sistema rumo ao Norte, São Paulo e Rio de Janeiro podem registrar recorde de frio nesta terça-feira"
682,Sobe para 11 o número de mortos por causa do ciclone que atinge o RS; 19 estão desaparecidos,https://jovempan.com.br/noticias/brasil/sobe-para-cinco-o-numero-de-mortos-por-causa-do-ciclone-que-atinge-o-rs-11-seguem-desaparecidos.html,2023-06-17 10:37:00,Jovem Pan,"As buscas por sobreviventes e vítimas seguem em andamento e, segundo as autoridades, já são 39 municípios atingidos, com registro de 2.330 desabrigados e 282 desalojados"
683,Três pessoas morrem e 12 estão desaparecidas após ciclone atingir o Sul do país,https://jovempan.com.br/noticias/brasil/tres-pessoas-morrem-e-12-estao-desaparecidas-apos-ciclone-atingir-o-sul-do-pais.html,2023-06-16 18:24:00,Jovem Pan,Fenômeno também causou inundações e deslizamentos; autoridades suspendem aulas
684,Ciclone extratropical: confira por onde vai passar e entenda como se forma,https://jovempan.com.br/noticias/brasil/ciclone-extratropical-confira-por-onde-vai-passar-e-entenda-como-se-forma.html,2023-06-16 11:33:00,Jovem Pan,"Fenômeno atinge os Estados do Sul do país desde quarta-feira, 14, e causou estragos no sul catarinense e no norte gaúcho"
685,"Ciclone no Sul do país mata uma pessoa, provoca inundações e deslizamentos e derruba árvores",https://jovempan.com.br/noticias/brasil/ciclone-no-sul-do-pais-derruba-arvores-provoca-inundacoes-e-deslizamentos-e-mata-uma-pessoa.html,2023-06-16 10:00:00,Jovem Pan,"Segundo Inmet, região segue em alerta para risco de fortes chuvas e ventos nesta sexta-feira, 16; duas pessoas estão desaparecidas no Rio Grande do Sul"
686,"Fortes chuvas voltam a castigar áreas em São Sebastião, litoral norte de São Paulo",https://jovempan.com.br/programas/jornal-da-manha/fortes-chuvas-voltam-a-castigar-areas-em-sao-sebastiao-litoral-norte-de-sao-paulo.html,2023-06-14 07:10:00,Jovem Pan,Cidade que foi atingida por fortes temporais em fevereiro registrou deslizamentos de terra e ruas alagadas; previsão é de que esse volume chegue a quase 180 mm de chuva
687,Defesa Civil emite alerta para fortes chuvas no Litoral Norte de São Paulo,https://jovempan.com.br/noticias/brasil/defesa-civil-emite-alerta-para-fortes-chuvas-no-litoral-norte-de-sao-paulo.html,2023-06-13 17:19:00,Jovem Pan,"Na capital, na Região Metropolitana e em Sorocaba, são esperadas chuvas moderadas; órgão pede para que população deixem áreas de risco ao encontrarem sinais de possíveis deslizamentos"
688,"Três meses após tragédia, São Sebastião trabalha para recuperar estruturas destruídas pelas chuvas",https://jovempan.com.br/programas/jornal-da-manha/tres-meses-apos-tragedia-sao-sebastiao-trabalha-para-recuperar-estruturas-destruidas-pelas-chuvas.html,2023-05-19 08:57:00,Jovem Pan,Cidade no litoral de São Paulo foi atingida por fortes chuvas que provocaram 65 mortes; volume de precipitação foi o maior já registrados no país em 24 horas
689,Chega a 70 o número de municípios no MA em emergência por causa da chuva,https://jovempan.com.br/noticias/brasil/chega-a-70-o-numero-de-municipios-no-ma-em-emergencia-por-causa-da-chuva.html,2023-04-15 17:15:00,Jovem Pan,Mais de 40 mil famílias foram afetadas com 8.434 desabrigados/desalojados e seis mortos
690,Fortes chuvas atingem o Rio de Janeiro e geram transtorno para moradores,https://jovempan.com.br/programas/jornal-da-manha/fortes-chuvas-atingem-o-rio-de-janeiro-e-geram-transtorno-para-moradores.html,2023-04-10 09:43:00,Jovem Pan,"Segundo autoridades, menos de oito horas, capital registrou mais de 74 milímetros de chuva; região dos Lagos e Serrana também foram atingidas pelos temporais"
691,Chuvas fortes deixam 64 cidades no Maranhão em estado de emergência,https://jovempan.com.br/programas/jornal-da-manha/chuvas-fortes-deixam-64-cidades-no-maranhao-em-estado-de-emergencia.html,2023-04-08 07:57:00,Jovem Pan,"De acordo com o Corpo de Bombeiros, 35.894 famílias foram afetadas pelas inundações e 7.757 estão desabrigadas e desalojadas"
692,"Com alerta de chuvas em SP, coronel da Defesa Civil pede ‘atenção especial’ a moradores de áreas de risco",https://jovempan.com.br/programas/jornal-da-manha/com-alerta-de-chuvas-em-sp-coronel-da-defesa-civil-pede-atencao-especial-a-moradores-de-areas-de-risco.html,2023-04-06 10:54:00,Jovem Pan,"De acordo com o órgão, há risco de desabamentos, desmoronamentos, deslizamentos, inundações e alagamentos nas áreas mais vulneráveis do leste do Estado"
693,Corpo de passista arrastado por enchente durante temporal no Rio de Janeiro é encontrado,https://jovempan.com.br/programas/jornal-da-manha/sobe-para-tres-o-numero-de-mortos-por-temporal-da-semana-passada-no-rio-de-janeiro.html,2023-04-03 06:39:00,Jovem Pan,Tancredo Augusto da Silva fazia parte da Mangueira e desapareceu na última quinta-feira
694,"Temporais, vendaval e ressaca marítima: Estado de SP tem risco de desastres naturais no final de semana",https://jovempan.com.br/programas/jornal-da-manha/temporais-vendaval-e-ressaca-maritima-estado-de-sp-tem-risco-de-desastres-naturais-no-final-de-semana.html,2023-04-01 13:23:00,Jovem Pan,"Em entrevista ao Jornal da Manhã, da Jovem Pan News, o capitão Felipe Carmelo Torres Zaupa falou sobre as chuvas que devem atingir diversas regiões e o trabalho de prevenção"
695,Chuva no fim de semana: Defesa Civil alerta para temporais no Estado de São Paulo; veja áreas afetadas,https://jovempan.com.br/noticias/brasil/chuva-no-fim-de-semana-defesa-civil-alerta-para-temporais-no-estado-de-sao-paulo-veja-areas-afetadas.html,2023-03-31 16:14:00,Jovem Pan,Órgão pede que população que vive em áreas de risco fique atenta a sinais de deslizamento de terra e deixe suas casas se notarem algo fora do comum
696,"Ciclone bomba pode atingir Rio de Janeiro e litoral paulista neste fim de semana, aponta Climatempo",https://jovempan.com.br/noticias/brasil/ciclone-bomba-pode-atingir-rio-de-janeiro-e-litoral-paulista-neste-fim-de-semana-aponta-climatempo.html,2023-03-31 15:22:00,Jovem Pan,"Fenômeno pode causar fortes temporais e ressaca nos dois estados; ondas podem chegar até 3,5 metros"
697,Governo de SP firma parceria com aplicativo Waze para divulgar alertas de enchentes,https://jovempan.com.br/programas/jornal-da-manha/governo-de-sp-firma-parceria-com-aplicativo-waze-para-divulgar-alertas-de-enchentes.html,2023-03-30 11:45:00,Jovem Pan,"Em entrevista à Jovem Pan News, o coordenador da Defesa Civil, coronel Henguel Ricardo Pereira, ainda ressaltou que 70% das vítimas do verão de 2023 foram arrastadas por enchentes"
698,Estragos causados pelas chuvas deixam 1.532 municípios em situação de emergência no Brasil,https://jovempan.com.br/noticias/brasil/estragos-causados-pelas-chuvas-deixam-1-532-municipios-em-situacao-de-emergencia-no-brasil.html,2023-03-27 22:53:00,Jovem Pan,Governo federal prepara um plano para conter as destruições provocadas pelos temporais
699,Ministros visitam Rio Branco após estragos causados pelas chuvas,https://jovempan.com.br/noticias/brasil/ministros-visitam-rio-branco-apos-estragos-causados-pelas-chuvas.html,2023-03-26 17:27:00,Jovem Pan,"Recursos federais serão destinados para a capital do Acre, que registrou mais de 32 mil pessoas atingidas por enchente e transbordamento de igarapés"
700,"Chuvas causam enchentes, arrastam casas e deixam região Norte em situação caótica",https://jovempan.com.br/noticias/brasil/chuvas-causam-enchentes-arrastam-casas-e-deixam-regiao-norte-em-situacao-caotica.html,2023-03-25 20:53:00,Jovem Pan,"Temporal afetou 32 mil pessoas apenas em Rio Branco, capital do Acre; Estado do Maranhão, no Nordeste, também foi atingido"
701,Chuva provoca seis mortes no Maranhão e deixa 33 municípios em situação de emergência,https://jovempan.com.br/noticias/brasil/chuva-provoca-seis-mortes-no-maranhao-e-deixa-33-municipios-em-situacao-de-emergencia.html,2023-03-21 17:00:00,Jovem Pan,"Segundo o Corpo de Bombeiros, 450 famílias estão desabrigadas e 520 desalojadas; Santa Luiza do Tide é uma das cidades mais afetadas"
702,"Com apoio do G10 Favelas, vítimas das enchentes em SP recebem marmitas e doações",https://jovempan.com.br/programas/jornal-da-manha/com-apoio-do-g10-favelas-vitimas-das-enchentes-em-sp-recebem-marmitas-e-doacoes.html,2023-03-15 14:45:00,Jovem Pan,"Em parceria com o projeto social Mãos de Maria a instituição iniciou, nesta terça-feira, 14, uma campanha para acolher a população da região do Jardim Pantanal"
703,"Temporal castiga São Paulo pelo 7º dia seguido, derruba árvores e provoca alagamentos",https://jovempan.com.br/noticias/brasil/chuva-em-sao-paulo-derruba-arvores-provoca-enchentes-e-deixa-capital-em-estado-de-atencao.html,2023-03-14 18:48:00,Jovem Pan,"Zona Leste foi a região mais afetada, de acordo com o Centro de Gerenciamento de Emergências; previsão é de que o volume de chuva caia a partir desta quarta-feira"
704,Chuva deixa pessoas ilhadas e carros submersos em São Paulo; corpo de mulher é encontrado no Tietê,https://jovempan.com.br/noticias/brasil/chuva-volta-a-provocar-alagamentos-e-coloca-toda-a-cidade-de-sp-em-estado-de-alerta.html,2023-03-13 16:26:00,Jovem Pan,"Corpo de Bombeiros registrou ao menos 25 chamados para quedas de árvores, 68 de enchentes e três desabamentos; CET contabilizava mais de 615 km de congestionamento por volta das 20h"
705,"Deslizamento de terra em Manaus deixa ao menos oito mortos, incluindo quatro crianças",https://jovempan.com.br/noticias/brasil/deslizamento-de-terra-em-manaus-deixa-ao-menos-oito-mortos-incluindo-quatro-criancas.html,2023-03-13 11:12:00,Jovem Pan,"Quatro vítimas pertenciam a uma mesma família; uma pessoa foi resgatada ainda com vida, mas não resistiu aos ferimentos"
706,Forte chuva paralisa trens da CPTM e alaga avenidas pela cidade de São Paulo,https://jovempan.com.br/noticias/brasil/forte-chuva-paralisa-trens-da-cptm-e-alaga-avenidas-pela-cidade-de-sao-paulo.html,2023-03-11 20:19:00,Jovem Pan,Linha 10-turquesa ficou paralisada por mais de uma hora entre as estações São Caetano do Sul e Santo André; bairros da Zona Leste são afetados
707,"‘Virou uma piscina de 2 metros de altura’, diz Ricardo Nunes sobre enchente em bairro de SP",https://jovempan.com.br/programas/jornal-da-manha/virou-uma-piscina-de-2-metros-de-altura-diz-ricardo-nunes-sobre-enchente-em-bairro-de-sp.html,2023-03-11 13:12:00,Jovem Pan,"Acúmulo de água em praça na região de Moema foi causado por obstrução indevida de viela sanitária e interrupção da drenagem; previsão é de novos temporais até a próxima terça-feira, 14"
708,"Chuva na Grande São Paulo causa enchentes, derruba mais de 80 árvores e provoca deslizamento em Guarulhos",https://jovempan.com.br/noticias/brasil/chuva-na-grande-sao-paulo-causa-enchentes-derruba-mais-de-70-arvores-e-provoca-deslizamento-em-guarulhos.html,2023-03-10 17:04:00,Jovem Pan,Corpo de Bombeiros registrou 31 ocorrências de alagamentos; capital enfrentou temporal pelo terceiro dia seguido
709,Moradores do Brooklin reclamam de alagamentos durante chuvas em São Paulo,https://jovempan.com.br/programas/jornal-da-manha/moradores-do-brooklin-reclamam-de-alagamentos-durante-chuvas-em-sao-paulo.html,2023-03-10 07:53:00,Jovem Pan,"Em denúncia enviada à Jovem Pan, morador relata situação e diz que vias ficam ‘intransitáveis’ quando chove no bairro da Zona Sul da capital paulista"
710,Chuva volta a provocar alagamentos em São Paulo nesta quinta-feira,https://jovempan.com.br/noticias/brasil/chuva-volta-a-provocar-alagamentos-em-sao-paulo-nesta-quinta-feira.html,2023-03-09 18:57:00,Jovem Pan,"Segundo o Corpo de Bombeiros, não houve vítimas; zonas Leste e Oeste foram as mais afetadas pelo temporal"
711,"Chuva em SP: Mulher morre em enchente, e Estado registra desabamentos, queda de árvores e alagamentos",https://jovempan.com.br/noticias/brasil/chuva-deixa-sao-paulo-em-alerta-provoca-desabamentos-queda-de-arvores-e-enchentes.html,2023-03-08 18:20:00,Jovem Pan,"Em Mauá, telhado caiu devido o vendaval e deixou duas crianças feridas; CET suspende rodízio municipal de veículos"
712,Governo prorroga prazo para atingidos por chuva no litoral norte pagarem tributos federais,https://jovempan.com.br/noticias/brasil/governo-prorroga-prazo-para-atingidos-por-chuva-no-litoral-norte-pagarem-tributos-federais.html,2023-03-07 16:46:00,Jovem Pan,"Medida vai auxiliar a população nos municípios de Guarujá, Bertioga, São Sebastião, Caraguatatuba, Ilhabela e Ubatuba"
713,Fundo Social de SP suspende recebimento de doações para vítimas das chuvas no litoral e recruta mais voluntários,https://jovempan.com.br/programas/jornal-da-manha/fundo-social-de-sp-suspende-recebimento-de-doacoes-para-vitimas-das-chuvas-no-litoral-e-recruta-mais-voluntarios.html,2023-03-02 12:13:00,Jovem Pan,"Quem deseja se voluntariar para auxiliar na triagem das doações e abastecimento dos caminhões, deve enviar um e-mail para doacoesfussp@sp.gov.br"
714,Moradores de São Sebastião tentam retomar a normalidade da vida após a tragédia,https://jovempan.com.br/programas/jornal-da-manha/moradores-de-sao-sebastiao-tentam-retomar-a-normalidade-da-vida-apos-a-tragedia.html,2023-03-02 12:07:00,Jovem Pan,"Após limpeza das ruas, população conta com doações e ainda teme novos incidentes quando chove"
715,Moradores da Zona Sul de SP sofrem com constantes alagamentos na região do Córrego Zavuvus,https://jovempan.com.br/programas/jornal-da-manha/moradores-da-zona-sul-de-sp-sofrem-com-constantes-alagamentos-na-regiao-do-corrego-zavuvus.html,2023-03-01 12:31:00,Jovem Pan,Equipe da Jovem Pan News foi averiguar a denúncia e flagrou pessoas na região que têm colocado grades nas portas e janelas para evitar que o lixo entre nas casas junto com a água
716,Tráfego na Rio-Santos será suspenso preventivamente quando houver novos sinais de deslizamentos,https://jovempan.com.br/programas/jornal-da-manha/rodovia-rio-santos-passa-a-ser-interditada-preventivamente-diante-de-riscos-de-deslizamentos.html,2023-03-01 07:20:00,Jovem Pan,"Temporais afetam o litoral norte de São Paulo, levando autoridades a se anteciparem a eventos trágicos que podem ocorrer"
717,Defesa Civil alerta para chuvas fortes no litoral norte de SP até quinta-feira,https://jovempan.com.br/noticias/brasil/defesa-civil-alerta-para-chuvas-fortes-no-litoral-norte-de-sp-ate-quinta-feira.html,2023-02-28 21:58:00,Jovem Pan,"Nesta terça-feira, bombeiros ficaram ilhados e Rio-Santos foi interditada por novos deslizamentos"
718,Novo temporal no litoral norte de SP deixa 34 bombeiros ilhados em local da tragédia,https://jovempan.com.br/noticias/brasil/novo-temporal-no-litoral-norte-de-sp-deixa-34-bombeiros-ilhados-em-local-da-tragedia.html,2023-02-28 18:10:00,Jovem Pan,DER informou que um trecho da Rio-Santos foi suspenso temporariamente; Defesa Civil alerta para possíveis novos deslizamentos
719,Novos deslizamentos em São Sebastião provocam três pontos de interdição na rodovia Rio-Santos,https://jovempan.com.br/noticias/brasil/novos-deslizamentos-em-sao-sebastiao-provocam-tres-pontos-de-interdicao-na-rodovia-rio-santos.html,2023-02-28 07:27:00,Jovem Pan,"Previsão do Corpo de Bombeiros é de que o fluxo de veículos seja retomado ainda nesta terça, com trabalhos de desobstrução realizados desde a madrugada"
720,Chuvas prejudicam trabalhos de equipes de buscas em São Sebastião,https://jovempan.com.br/programas/jornal-da-manha/chuvas-prejudicam-trabalhos-de-equipes-de-buscas-em-sao-sebastiao.html,2023-02-28 06:49:00,Jovem Pan,Ao menos uma pessoa segue desaparecida no município Baleia Verde; volta dos temporais preocupam autoridades
721,Fenômeno raro: Chuva faz trilha ficar submersa em Mato Grosso do Sul,https://jovempan.com.br/noticias/brasil/fenomeno-raro-chuva-faz-trilha-ficar-submersa-em-mato-grosso-do-sul.html,2023-02-27 21:27:00,Jovem Pan,Fotógrafo registra momento e ‘anda’ debaixo da água
722,Prefeitura de Ubatuba pede para que turistas retornem ao município após chuvas,https://jovempan.com.br/noticias/brasil/prefeitura-de-ubatuba-pede-para-que-turistas-retornem-ao-municipio-apos-chuvas.html,2023-02-27 17:02:00,Jovem Pan,"Segundo a administração local, os serviços voltaram a funcionar normalmente na cidade; na semana passada, governador pediu para que população evite o litoral paulista em razão dos estragos causados pelo temporal"
723,Sobe para 64 o número de mortos pelas chuvas no litoral norte de SP; Bombeiros buscam último desaparecido,https://jovempan.com.br/noticias/brasil/sobe-para-64-o-numero-de-mortos-pelas-chuvas-no-litoral-norte-de-sp-bombeiros-buscam-ultimo-desaparecido.html,2023-02-26 10:45:00,Jovem Pan,Total de desabrigados e desalojados caiu para 2.440 após início das ações para realocar a população em espaços seguros
724,"Após uma semana das chuvas no litoral, governo de SP foca retomada social e econômica das cidades afetadas",https://jovempan.com.br/noticias/brasil/apos-uma-semana-das-chuvas-no-litoral-governo-de-sp-foca-retomada-social-e-economica-das-cidades-afetadas.html,2023-02-26 08:25:00,Jovem Pan,"Com seis pessoas ainda desaparecidas, administração pública mantém operações de busca e resgate, mas tenta agilizar ações para abrigar as mais de 4 mil pessoas que ficaram sem suas casas, além de abrir linhas de crédito especiais para empresas"
725,Mortes na tragédia do litoral norte de SP sobem para 59; seis pessoas estão desaparecidas,https://jovempan.com.br/noticias/brasil/sobe-para-59-o-numero-de-mortos-apos-temporal-no-litoral-norte-de-sp.html,2023-02-25 19:36:00,Jovem Pan,"De acordo com o governo do Estado de São Paulo, a prioridade segue no socorro às vítimas e no atendimento dos mais de 2.251 desalojados e 1.815 desabrigados"
726,Alckmin diz que governo estuda usar moradias em Bertioga para realocar vítimas das chuvas,https://jovempan.com.br/noticias/brasil/alckmin-diz-que-governo-estuda-usar-moradias-em-bertioga-para-realocar-vitimas-das-chuvas.html,2023-02-25 13:08:00,Jovem Pan,Vice-presidente do Brasil sobrevoou o litoral neste sábado e se reuniu com autoridades locais para discutir ações às pessoas mais afetadas
727,Papa Francisco presta solidariedade às vítimas das chuvas no litoral norte de São Paulo,https://jovempan.com.br/noticias/brasil/papa-francisco-presta-solidariedade-as-vitimas-das-chuvas-no-litoral-norte-de-sao-paulo.html,2023-02-25 11:20:00,Jovem Pan,Vídeo em que o pontífice envia suas orações foi publicado nas redes sociais pela prefeitura de São Sebastião
728,Caixa Econômica começa a liberar benefícios para vítimas das chuvas no litoral norte de SP,https://jovempan.com.br/programas/jornal-da-manha/caixa-economica-comeca-a-liberar-beneficios-para-vitimas-das-chuvas-no-litoral-norte-de-sp.html,2023-02-25 07:46:00,Jovem Pan,"Saque Calamidade do FGTS e antecipação do Auxílio Brasil, que volta a se chamar Bolsa Família, estão dentro do pacote anunciado pela instituição"
729,Governo de SP libera mais de R$ 350 milhões em crédito para afetados por chuvas no litoral norte,https://jovempan.com.br/noticias/brasil/governo-de-sp-libera-mais-de-r-350-milhoes-em-credito-para-afetados-por-chuvas-no-litoral-norte.html,2023-02-23 22:08:00,Jovem Pan,"Iniciativa beneficia microempreendedores, empresas, municípios e setor de Turismo"
730,Rio de Janeiro registra aumento de 66% de chuva em relação à média de fevereiro,https://jovempan.com.br/programas/jornal-da-manha/rio-de-janeiro-registra-aumento-de-66-de-chuva-em-relacao-a-media-de-fevereiro.html,2023-02-23 11:53:00,Jovem Pan,"Entre os dias 1º e 22, o Alerta Rio, órgão de meteorologia da prefeitura da capital fluminense, registrou 200mm na cidade, o que corresponde a 200 litros por metro quadrado"
731,"Litoral norte de SP deve sofrer com chuva, granizo e vendaval nesta quinta; número de mortos sobe para 50",https://jovempan.com.br/noticias/brasil/litoral-norte-de-sp-deve-sofrer-com-chuva-granizo-e-vendaval-nesta-quinta-numero-de-mortos-sobe-para-49.html,2023-02-23 10:23:00,Jovem Pan,Força-tarefa atua ininterruptamente na região com operações de busca e resgate de desaparecidos
732,Corretor explica o que fazer com os seguros em caso de desastres naturais como no litoral paulista,https://jovempan.com.br/programas/jornal-da-manha/corretor-explica-o-que-fazer-com-os-seguros-em-caso-de-desastres-naturais-como-no-litoral-paulista.html,2023-02-23 09:25:00,Jovem Pan,"Em entrevista ao Jornal da Manhã, da Jovem Pan News, o presidente do Sincor-SP, Boris Ber, explicou como estes serviços podem funcionar em meio aos estragos"
733,São Paulo tem previsão de pancadas fortes de chuva no fim do dia,https://jovempan.com.br/noticias/brasil/sao-paulo-tem-previsao-de-pancadas-fortes-de-chuva-no-fim-do-dia.html,2023-02-22 14:15:00,Jovem Pan,"No início da tarde, foi observada chuva leve e lenta na Zona Sul da cidade, mas ainda há potencial para alagamentos, rajadas de vento e transbordamentos de rios e córregos"
734,Secretário de Desenvolvimento Social de SP fala sobre apoio econômico às vítimas das chuvas no litoral,https://jovempan.com.br/programas/jornal-da-manha/secretario-de-desenvolvimento-social-de-sp-fala-sobre-apoio-economico-as-vitimas-das-chuvas-no-litoral.html,2023-02-22 10:59:00,Jovem Pan,"Em entrevista ao Jornal da Manhã, da Jovem Pan News, Gilberto Nascimento falou sobre medidas para auxiliar as vítimas das chuvas; de acordo com o último boletim do governo, são 1.730 desalojados e 766 desabrigados até o momento"
735,Jovem Pan apoia campanhas de doações para famílias vítimas das chuvas no litoral de SP; saiba como ajudar,https://jovempan.com.br/noticias/brasil/jovem-pan-apoia-campanhas-de-doacoes-para-familias-vitimas-das-chuvas-no-litoral-de-sp-saiba-como-ajudar.html,2023-02-22 07:51:00,Jovem Pan,"Cruz Vermelha, Fundo Social de São Paulo e Central Única das Favelas são algumas das instituições atuando na questão; ao todo, 2,5 mil pessoas estão desalojadas ou desabrigadas na região após os deslizamentos de terra e desabamentos de imóveis ocorridos"
